Lonie Handcrafted Plastic Mouse,Ball,1,2,true,1894.00,  Handcrafted Ball,Dolorem nobis aut suscipit. Excepturi consectetur et. Qui consequatur sequi. Quos at laborum rerum et est eveniet minus accusamus est.,https://source.unsplash.com/collection/1163637/100x100,229.748.206,false,null,null
Rupert Licensed Fresh Chicken,Table,2,2,false,1402.00,  Fantastic Table,Dolor voluptas cumque corrupti labore soluta. Repellat repellat aperiam at autem qui. Ad optio impedit ut consequatur culpa fuga. Quasi quia aliquid tempora et ut nesciunt.,https://source.unsplash.com/collection/1163637/100x100,919.424.547,false,null,null
Krystal Fantastic Steel Bacon,Tuna,4,5,true,1625.00,  Fantastic Tuna,Sapiente distinctio autem vel minima quo corrupti est modi. Consequatur consequatur quo ducimus ut asperiores. Esse unde numquam.,https://source.unsplash.com/collection/1163637/100x100,477.766.549,true,Efrain Sleek Metal Chicken,Bike
Wilhelm Unbranded Metal Keyboard,Chair,3,3,true,1492.00,  Fantastic Chair,Minima veniam deleniti nam tempora quibusdam sunt ut. Incidunt et molestiae et inventore nihil. Esse quis exercitationem esse corporis doloremque modi qui autem. Quibusdam iusto voluptas magnam.,https://source.unsplash.com/collection/1163637/100x100,823.193.916,false,null,null
Furman Sleek Steel Bike,Tuna,3,5,false,1102.00,  Intelligent Tuna,Aperiam rerum rerum exercitationem voluptatum minima labore ipsam velit molestias. Autem maxime soluta natus eveniet veritatis ipsa eligendi ea veritatis. Reprehenderit dolores aliquam sint.,https://source.unsplash.com/collection/1163637/100x100,409.95.211,false,null,null
Isadore Gorgeous Wooden Chips,Computer,4,4,false,1408.00,  Fantastic Computer,Dolor veniam voluptatem velit dolorem velit quos consequatur omnis. Deserunt dolores libero harum consequatur id. Voluptates ipsam consectetur libero similique.,https://source.unsplash.com/collection/1163637/100x100,829.957.455,true,Lottie Gorgeous Metal Hat,Shoes
Perry Rustic Plastic Bacon,Tuna,2,3,false,1979.00,  Sleek Tuna,Et omnis excepturi incidunt et in veritatis perspiciatis expedita. Accusamus commodi et sit consectetur sapiente cumque. Assumenda consequatur sunt porro delectus. Aut fugiat sed veniam aut accusamus quod tempore. Tempora et dolor laborum dolore ipsa sunt autem in.,https://source.unsplash.com/collection/1163637/100x100,936.843.19,true,Cordell Small Fresh Chair,Soap
Tiara Intelligent Steel Soap,Ball,3,1,false,1014.00,  Unbranded Ball,Commodi deleniti et ea ut et quos provident velit. Mollitia sint aliquid sequi incidunt ut voluptatem dicta fugiat ut. Nihil rerum fugit optio ipsam officia autem sint. Qui dolor est incidunt et facilis consequatur est.,https://source.unsplash.com/collection/1163637/100x100,755.320.616,false,null,null
Billy Refined Rubber Hat,Keyboard,3,2,false,1893.00,  Rustic Keyboard,Iure molestias sint soluta quia quia consequatur. Possimus et totam totam fugit quod facere ullam. Cupiditate enim quia rerum consequuntur ab et perferendis quod quod. Veritatis rerum harum dignissimos nihil ea est cum provident. Ea id aliquam omnis quisquam at et laudantium et aut.,https://source.unsplash.com/collection/1163637/100x100,987.976.710,false,null,null
Allen Licensed Rubber Pizza,Sausages,5,5,true,1041.00,  Practical Sausages,Soluta aliquid eum ex consectetur. Asperiores id eos enim quo voluptas quasi voluptate quasi quia. Consequatur culpa praesentium aliquam ut velit consectetur ratione aut. Autem qui molestiae accusamus eaque. Officiis nostrum provident. Quo perspiciatis hic odit.,https://source.unsplash.com/collection/1163637/100x100,150.489.108,false,null,null
Britney Licensed Granite Shoes,Pizza,3,3,true,1602.00,  Gorgeous Pizza,Earum veritatis et voluptas et quis illum ipsa. Ut ut debitis voluptas vero omnis quod soluta voluptatem. Reprehenderit amet magni totam id. Velit et mollitia totam similique ut. Tempora soluta omnis doloremque et ut ipsam ab. Accusantium quasi nemo porro rerum eos.,https://source.unsplash.com/collection/1163637/100x100,579.100.521,false,null,null
Brandon Handmade Metal Chair,Sausages,1,3,false,1500.00,  Unbranded Sausages,Cumque sint eveniet fuga. Voluptas tempora ducimus. Sapiente laboriosam nulla impedit. Autem et odio quo voluptatem sunt. Reprehenderit tempore nobis repudiandae temporibus facilis sequi facilis.,https://source.unsplash.com/collection/1163637/100x100,665.516.136,true,Wilson Rustic Rubber Cheese,Hat
Hettie Practical Wooden Pants,Hat,2,3,true,1739.00,  Generic Hat,Provident est exercitationem et et excepturi qui laudantium aliquam dolorem. Molestias voluptates accusamus tempora suscipit. Praesentium dolorem magni mollitia pariatur. Possimus nihil dolorum. Amet quo dolor rerum nihil laboriosam quia et aut. Aspernatur sunt temporibus impedit magni aperiam.,https://source.unsplash.com/collection/1163637/100x100,839.718.170,true,Deshaun Rustic Metal Ball,Chair
Mariane Fantastic Steel Keyboard,Sausages,3,2,true,1210.00,  Licensed Sausages,Eos id est. Ratione ab tempore commodi tenetur possimus nemo. Sunt inventore saepe aliquid. Impedit occaecati et. Eius quo aut ipsam repellendus cupiditate. Dolorem minus sed deserunt maxime voluptatem et.,https://source.unsplash.com/collection/1163637/100x100,966.946.178,false,null,null
Clara Fantastic Plastic Car,Cheese,3,5,false,1946.00,  Refined Cheese,Asperiores sed est tenetur sit quibusdam quis libero adipisci sed. Sint vel quo voluptas modi et numquam quo omnis. Qui eveniet sequi inventore.,https://source.unsplash.com/collection/1163637/100x100,623.513.510,true,Name Intelligent Soft Gloves,Pants
Luz Rustic Frozen Table,Hat,4,5,false,1302.00,  Awesome Hat,Laboriosam qui ab in qui omnis quas et. Quis quos et commodi quia rerum at non necessitatibus odio. Ut et non. Sit rem similique similique nihil illum. Autem praesentium consectetur a quod. Maiores quia deleniti.,https://source.unsplash.com/collection/1163637/100x100,536.139.190,true,Camylle Gorgeous Wooden Shirt,Ball
Lina Practical Metal Gloves,Hat,5,3,false,1179.00,  Intelligent Hat,In quod omnis error amet corrupti facere dolor dolor sunt. Harum consequatur aut nemo ut omnis molestiae sit mollitia veritatis. Placeat excepturi ut. Qui dignissimos quo rerum tempore natus reprehenderit neque. Quia perspiciatis sed incidunt numquam deleniti quo autem voluptas. Consequatur quod maxime beatae dolores minus nostrum.,https://source.unsplash.com/collection/1163637/100x100,172.611.747,false,null,null
Bret Ergonomic Granite Shirt,Tuna,1,2,false,1036.00,  Intelligent Tuna,Quos quibusdam voluptatibus est ut. Est repudiandae odit ad reiciendis repellendus eligendi. Quas omnis fugit at. Voluptatibus qui excepturi facilis iure natus dolorum. Provident suscipit libero ipsa. Quas saepe repellat qui.,https://source.unsplash.com/collection/1163637/100x100,525.406.522,true,Jerrold Intelligent Rubber Pants,Ball
Javonte Refined Cotton Hat,Car,2,1,true,1858.00,  Tasty Car,Corrupti quos consequuntur quia quidem. Corrupti voluptates alias sed laborum. Deleniti qui sit voluptatibus.,https://source.unsplash.com/collection/1163637/100x100,878.333.5,true,Maxie Awesome Concrete Hat,Bike
Nash Tasty Cotton Keyboard,Chair,2,3,true,1772.00,  Ergonomic Chair,Placeat ut qui et quo atque dolorum excepturi saepe est. Eius voluptatem quibusdam laboriosam voluptas recusandae quia et cum et. Modi mollitia minima temporibus tempore similique quisquam ipsam cupiditate vel. Et ut sequi quisquam. Voluptate ut provident eos dolorem omnis.,https://source.unsplash.com/collection/1163637/100x100,899.370.57,true,Margarita Handmade Granite Car,Tuna
Kelly Sleek Plastic Hat,Chair,5,5,false,1377.00,  Refined Chair,Fuga nam qui ipsum. Iusto nostrum quisquam eligendi nihil. Autem sed aliquid est et.,https://source.unsplash.com/collection/1163637/100x100,199.238.440,true,Adell Generic Rubber Cheese,Hat
Rebeka Fantastic Wooden Gloves,Sausages,1,4,false,1405.00,  Unbranded Sausages,Eligendi et perferendis quo cumque rerum. Eum similique dolor omnis. Ea consequatur autem veritatis perspiciatis qui mollitia modi dolore dolores. Ut nemo culpa. Consequatur porro error eum vel deserunt quo sed accusamus ea.,https://source.unsplash.com/collection/1163637/100x100,376.75.624,true,Jabari Incredible Wooden Cheese,Soap
Molly Small Frozen Chicken,Chicken,2,3,false,1725.00,  Ergonomic Chicken,Voluptas ducimus expedita dolorum natus totam. Dolor nostrum sunt quo repudiandae. Non ut illo perferendis recusandae et ut quo quam necessitatibus. Dolorem mollitia voluptatem asperiores maiores repellendus. Maiores velit sunt velit quod.,https://source.unsplash.com/collection/1163637/100x100,118.580.880,false,null,null
Anissa Handmade Concrete Cheese,Chips,5,3,false,1991.00,  Licensed Chips,Delectus nemo ut harum modi dolores illo. Velit voluptatem commodi inventore voluptatem. Dolorem nobis a aliquid autem nostrum iusto laboriosam incidunt. Animi aut aut ut saepe. Quaerat laboriosam doloribus dignissimos explicabo ut libero assumenda accusamus. Architecto sed pariatur facere.,https://source.unsplash.com/collection/1163637/100x100,512.917.909,true,Stefanie Ergonomic Rubber Computer,Towels
Lyric Rustic Wooden Pants,Cheese,2,2,true,1395.00,  Intelligent Cheese,Commodi ipsam necessitatibus velit eius. Et praesentium architecto voluptate est consequuntur corporis. Est itaque ea temporibus. Sed deserunt autem. Qui dolorem excepturi numquam. Magni vero officiis rerum nesciunt dolorem distinctio consequatur.,https://source.unsplash.com/collection/1163637/100x100,558.693.308,false,null,null
Ivory Awesome Concrete Cheese,Tuna,3,1,false,1388.00,  Ergonomic Tuna,Alias ut sed sunt. Recusandae quaerat sint rerum harum ut sequi. Molestias quaerat eos.,https://source.unsplash.com/collection/1163637/100x100,732.561.986,false,null,null
Moriah Practical Plastic Tuna,Pizza,5,3,true,1507.00,  Licensed Pizza,Ex qui ratione. Qui nam sapiente porro expedita qui exercitationem non quia vitae. Accusamus a rerum harum.,https://source.unsplash.com/collection/1163637/100x100,891.443.870,false,null,null
Felipa Unbranded Wooden Computer,Computer,2,4,true,1246.00,  Refined Computer,Laborum aperiam maxime aperiam ullam. Quo et quos exercitationem tenetur saepe. Ea quibusdam dignissimos consequatur omnis ipsum. Maxime ut voluptatibus rerum tempora. Incidunt quasi sit inventore voluptate nisi. Tenetur necessitatibus nemo ut.,https://source.unsplash.com/collection/1163637/100x100,118.515.630,false,null,null
Saige Incredible Fresh Shoes,Mouse,2,1,true,1605.00,  Tasty Mouse,Voluptas voluptatem non sed. Eos ratione et molestiae voluptate non ducimus laudantium. Ut velit ipsa voluptas sunt et minima molestias. Officiis dolores excepturi eos hic. Ipsum natus et. Delectus ut qui id non sunt.,https://source.unsplash.com/collection/1163637/100x100,393.557.694,false,null,null
Ben Fantastic Plastic Ball,Computer,3,5,false,1878.00,  Small Computer,Quidem necessitatibus voluptates repudiandae. Est consequatur est nemo. Cumque necessitatibus architecto. Libero non aut rerum. Molestias laudantium culpa minima dolor in odio impedit iusto. Rerum dolores reiciendis quos cupiditate error enim numquam eius velit.,https://source.unsplash.com/collection/1163637/100x100,504.216.114,true,Kyleigh Unbranded Frozen Towels,Hat
Verlie Awesome Steel Bike,Shoes,3,1,false,1409.00,  Handmade Shoes,Vitae sed temporibus. Animi omnis assumenda ullam. Sapiente ut distinctio et enim enim id totam. Dicta qui tenetur optio perferendis.,https://source.unsplash.com/collection/1163637/100x100,588.288.372,false,null,null
Casimer Generic Cotton Salad,Towels,5,5,false,1941.00,  Handcrafted Towels,Fugiat maiores magnam aperiam ipsum repudiandae ratione delectus est. Fugit perferendis deleniti qui magni nihil nihil sunt ut. Omnis voluptas soluta consequatur rerum optio sunt nobis qui. Dolore labore vel qui ut maxime. Nulla tempora totam repellat rerum nulla fuga accusamus. Iste fuga consequatur tempore quod officiis quia temporibus numquam.,https://source.unsplash.com/collection/1163637/100x100,965.885.570,false,null,null
Damaris Licensed Metal Computer,Hat,1,5,false,1426.00,  Refined Hat,Et expedita saepe non aut aut. Ipsam nobis perferendis corrupti magnam non similique occaecati modi dolorum. Vero cumque repellat eaque saepe est accusamus. Adipisci cum id quisquam inventore assumenda dolorum nesciunt.,https://source.unsplash.com/collection/1163637/100x100,153.926.120,true,Jaunita Gorgeous Concrete Chair,Gloves
Rafaela Handmade Wooden Tuna,Mouse,2,5,false,1743.00,  Practical Mouse,Qui a repellendus qui repellendus praesentium iste voluptate qui voluptates. Non ipsum sunt quis soluta velit. Mollitia quos alias repellat qui blanditiis eos non.,https://source.unsplash.com/collection/1163637/100x100,718.262.611,false,null,null
Alfonso Licensed Frozen Cheese,Soap,2,4,false,1718.00,  Handmade Soap,Magnam eos architecto eum ut. Sequi quo qui aut aut consequatur voluptatem nostrum aperiam et. Rerum et nam aut.,https://source.unsplash.com/collection/1163637/100x100,550.319.230,false,null,null
Chelsea Small Wooden Chips,Keyboard,4,4,false,1734.00,  Handcrafted Keyboard,Vitae dolore dolor ut reprehenderit. Vero rem dolorem. Perferendis et quo. Vero ullam asperiores aliquam voluptas sequi sed.,https://source.unsplash.com/collection/1163637/100x100,401.798.552,true,Lorna Refined Soft Tuna,Pizza
Selena Gorgeous Granite Chair,Bacon,5,2,true,1735.00,  Unbranded Bacon,Voluptatem debitis et aliquid iste. Quod molestias ex illo. Quibusdam dolorem laboriosam. Vitae dicta tempora aspernatur. Rerum et pariatur aut consequatur impedit quia.,https://source.unsplash.com/collection/1163637/100x100,652.840.775,true,Maribel Generic Granite Pants,Salad
Yoshiko Refined Granite Chicken,Bacon,4,1,true,1248.00,  Fantastic Bacon,Sit quidem quam itaque. Est corporis quis architecto voluptatem aliquid. Repudiandae maiores ex quos aut suscipit veritatis.,https://source.unsplash.com/collection/1163637/100x100,403.119.9,true,Tod Sleek Soft Shoes,Pizza
Elinore Refined Frozen Bacon,Table,1,4,true,1978.00,  Fantastic Table,Exercitationem sapiente adipisci qui consectetur rerum animi. Magnam consequuntur odit id vitae nisi. Quis ut cumque et asperiores est qui deserunt. Occaecati molestiae deleniti laboriosam magni et velit qui magni minima.,https://source.unsplash.com/collection/1163637/100x100,729.302.361,false,null,null
Griffin Gorgeous Frozen Mouse,Keyboard,4,1,false,1778.00,  Small Keyboard,Et enim labore quia dolor voluptate quis ut voluptatem inventore. Eligendi ut rerum voluptatem nisi doloremque itaque dolores veniam officia. Voluptatem dolor libero minus ea qui dolorum perspiciatis. Temporibus sint quasi. Rem voluptatem doloribus.,https://source.unsplash.com/collection/1163637/100x100,157.410.139,false,null,null
Janessa Fantastic Plastic Tuna,Shoes,2,5,false,1123.00,  Refined Shoes,Non debitis iste eius libero voluptatem quas et. Animi quia incidunt aut quia magni in eaque. Velit voluptatum a qui.,https://source.unsplash.com/collection/1163637/100x100,725.649.772,false,null,null
Desiree Gorgeous Soft Shoes,Bacon,4,3,true,1834.00,  Sleek Bacon,Quos hic aut. Placeat facere nobis debitis vel perferendis. Et repellendus necessitatibus veritatis mollitia error consectetur corrupti. Qui et ut dolor animi reiciendis deleniti accusantium quo vel.,https://source.unsplash.com/collection/1163637/100x100,851.118.413,false,null,null
Austin Licensed Cotton Pants,Table,4,2,true,1153.00,  Small Table,Nulla dignissimos et recusandae. Quis aliquam unde accusantium ut. Consectetur minima cumque eos. Sit sunt ab similique rerum. Nobis aut omnis eum. Ea labore dignissimos ea placeat laboriosam.,https://source.unsplash.com/collection/1163637/100x100,654.198.932,true,Alycia Tasty Fresh Hat,Towels
Christelle Handcrafted Concrete Chips,Computer,4,4,false,1456.00,  Practical Computer,Non atque quis quia saepe enim. Sunt alias voluptatem sunt adipisci qui voluptatem. Voluptates et ut laborum sint quas omnis. Est architecto dolore sequi quo illum.,https://source.unsplash.com/collection/1163637/100x100,960.530.784,true,Kody Generic Cotton Chicken,Table
Kirstin Fantastic Fresh Shoes,Sausages,4,2,true,1515.00,  Handmade Sausages,Possimus illo et eum. Atque quis ipsa aperiam voluptas est. Voluptatem delectus neque aut ducimus illo dolor autem. Modi ducimus maxime porro hic. Omnis maiores natus veniam exercitationem numquam harum adipisci inventore.,https://source.unsplash.com/collection/1163637/100x100,64.340.713,true,Rozella Refined Wooden Chips,Car
Justus Sleek Fresh Tuna,Cheese,4,3,true,1276.00,  Small Cheese,Architecto numquam voluptatum eum aliquid aut voluptatem debitis laborum. Exercitationem est et veritatis voluptate doloremque facilis voluptatem. Aliquam atque harum.,https://source.unsplash.com/collection/1163637/100x100,776.428.119,false,null,null
Shany Gorgeous Metal Chips,Bike,3,1,true,1009.00,  Licensed Bike,Sunt optio earum ipsum dolores necessitatibus consectetur doloremque et voluptas. Consequatur quia cupiditate voluptatem sapiente reiciendis necessitatibus corporis eveniet. Quod dolor ut dolore excepturi iste eaque quis. Ex et ipsum quasi corrupti.,https://source.unsplash.com/collection/1163637/100x100,702.481.684,true,Kacie Incredible Soft Bacon,Chair
Mckenna Incredible Soft Hat,Sausages,5,1,false,1315.00,  Awesome Sausages,Soluta commodi et ea quam animi consequatur. In laudantium culpa facilis doloremque commodi enim labore fuga sit. Ullam optio sunt facilis est voluptatem est. Quas ipsam quaerat ex qui occaecati laboriosam qui porro. Fugiat cum ab consequatur magni facere possimus odio.,https://source.unsplash.com/collection/1163637/100x100,385.345.344,true,Ruth Sleek Granite Computer,Sausages
Lance Intelligent Steel Pizza,Sausages,2,2,false,1314.00,  Ergonomic Sausages,Dolorem omnis aut et iste. Qui cumque aliquid saepe est vero iste occaecati. Sint quaerat optio ad deserunt. Eos eligendi labore et quaerat. Molestiae occaecati eligendi similique dicta ex veniam dicta consequatur nostrum.,https://source.unsplash.com/collection/1163637/100x100,211.80.262,true,Elsa Small Wooden Hat,Shoes
Bria Awesome Cotton Shoes,Mouse,4,5,false,1181.00,  Practical Mouse,Consequatur ea provident. Suscipit ut vel. Dolorum rem officiis.,https://source.unsplash.com/collection/1163637/100x100,977.488.122,false,null,null
Alexandrine Intelligent Fresh Ball,Towels,3,2,false,1974.00,  Generic Towels,Quasi excepturi perferendis non voluptas. Delectus deleniti et possimus voluptate voluptatum ut omnis voluptas. Suscipit aspernatur cupiditate. Magnam debitis quia. Dolor et sit non officiis.,https://source.unsplash.com/collection/1163637/100x100,334.602.284,false,null,null
Enid Ergonomic Frozen Table,Chips,3,5,true,1815.00,  Handmade Chips,Aut nam totam laudantium. Vero ad aut quas voluptatem. Quia dolor dicta quis. Minima exercitationem et voluptate. Modi in nostrum id recusandae doloremque perspiciatis modi officiis. Fugit omnis eius repellat et aut sed.,https://source.unsplash.com/collection/1163637/100x100,208.108.140,false,null,null
Frederick Sleek Concrete Bike,Shirt,2,2,false,1835.00,  Incredible Shirt,Quis voluptate qui. Praesentium est maiores asperiores debitis soluta sint sit. Eaque dolor ut quam deserunt doloremque placeat voluptates possimus.,https://source.unsplash.com/collection/1163637/100x100,45.704.489,false,null,null
Edgardo Licensed Frozen Shoes,Chair,1,5,false,1394.00,  Handmade Chair,Facilis aut minus dolor voluptatem dolores neque id deleniti. Dolores qui ut. Est nulla sunt autem voluptatem odio labore officiis et. Laudantium provident minima voluptatum laborum qui culpa maxime aliquam eaque. Autem beatae quod hic qui odit ipsum eligendi. Occaecati commodi aliquam dolor molestias facilis voluptates odio in non.,https://source.unsplash.com/collection/1163637/100x100,484.759.867,false,null,null
Kaylin Handcrafted Metal Cheese,Tuna,3,4,true,1300.00,  Intelligent Tuna,Sed asperiores qui ducimus similique et non quisquam. Laboriosam minus et vero. Molestiae commodi ut expedita. Ullam qui recusandae. Itaque qui omnis adipisci. Modi ullam autem vel enim.,https://source.unsplash.com/collection/1163637/100x100,140.864.686,false,null,null
Monique Fantastic Wooden Chicken,Gloves,1,1,false,1130.00,  Generic Gloves,Voluptas incidunt dicta. Pariatur est eum perferendis repellendus iure. Fugiat qui voluptate quibusdam ullam dolorem doloremque. Aut ut provident animi.,https://source.unsplash.com/collection/1163637/100x100,538.60.587,true,Cicero Handcrafted Fresh Salad,Car
Rodolfo Generic Soft Table,Ball,4,3,false,1427.00,  Ergonomic Ball,Quos saepe consequatur ut voluptas molestiae tempora accusantium. Doloremque delectus quisquam placeat. Ut neque magnam soluta nesciunt ut voluptatem velit quas. Minima saepe et deleniti.,https://source.unsplash.com/collection/1163637/100x100,41.828.250,false,null,null
Jeffery Handcrafted Frozen Fish,Sausages,5,2,false,1739.00,  Licensed Sausages,Temporibus recusandae exercitationem itaque provident omnis dignissimos. Ex vel necessitatibus sint aut maiores illo sed possimus. Commodi sed iste. Facere aliquam distinctio totam. Dolores ullam consequatur neque similique.,https://source.unsplash.com/collection/1163637/100x100,50.962.517,true,Amparo Incredible Soft Keyboard,Hat
Elva Handmade Wooden Shoes,Soap,3,1,false,1661.00,  Incredible Soap,Natus autem dolores repudiandae excepturi nesciunt. Ut similique est. Voluptates iusto repellat ipsam.,https://source.unsplash.com/collection/1163637/100x100,163.921.904,false,null,null
Gabriella Gorgeous Fresh Computer,Mouse,3,4,true,1068.00,  Rustic Mouse,Magni non et quaerat ipsum consequatur dolorem quam sit. Aspernatur ut quia quia dolore reiciendis ipsam beatae. Blanditiis quae adipisci totam architecto consequatur non autem aut et.,https://source.unsplash.com/collection/1163637/100x100,223.66.627,true,Damaris Refined Steel Cheese,Keyboard
Eddie Sleek Frozen Soap,Bacon,3,5,false,1067.00,  Awesome Bacon,Modi veniam vitae ducimus velit. Voluptatem enim sit quia. Cumque incidunt voluptate aut autem mollitia itaque earum. Facilis quia sit nesciunt est possimus aut qui.,https://source.unsplash.com/collection/1163637/100x100,703.73.752,true,Raphael Gorgeous Soft Towels,Tuna
Russell Sleek Wooden Keyboard,Bike,1,5,true,1211.00,  Refined Bike,Dolor debitis et ut omnis quam eius vel veritatis fugit. Nihil qui totam dolorem facilis nihil dolor praesentium atque et. Mollitia maxime sapiente voluptatum sit quae assumenda veritatis porro aut. Et dolores cum voluptates qui doloribus laboriosam nostrum. Harum impedit beatae ducimus.,https://source.unsplash.com/collection/1163637/100x100,715.229.489,true,Sincere Handcrafted Soft Salad,Gloves
Randy Unbranded Cotton Bacon,Mouse,3,5,true,1645.00,  Rustic Mouse,Eos id illum voluptate nisi quae expedita nisi placeat ut. Dolorem rerum consequatur sed aut reiciendis aperiam. A dolores molestiae libero nihil. Blanditiis assumenda ut quia dolores blanditiis perspiciatis animi animi officiis.,https://source.unsplash.com/collection/1163637/100x100,881.97.230,true,Adelbert Generic Steel Towels,Bike
Dorthy Generic Metal Bacon,Computer,3,3,true,1567.00,  Ergonomic Computer,Incidunt culpa rerum architecto voluptatem mollitia consectetur. Rerum minima omnis dolor. Quia eligendi in. Nisi repudiandae consequatur pariatur alias laboriosam rerum provident sapiente.,https://source.unsplash.com/collection/1163637/100x100,175.649.150,true,Brice Ergonomic Rubber Gloves,Car
Violet Handcrafted Metal Table,Tuna,1,4,true,1538.00,  Refined Tuna,Reiciendis exercitationem consequatur reiciendis minus amet esse quo. Non odit labore accusantium dolor alias corrupti. Et perferendis officiis ex et quia sint provident quasi.,https://source.unsplash.com/collection/1163637/100x100,471.39.97,false,null,null
Pamela Refined Wooden Mouse,Cheese,4,2,false,1052.00,  Incredible Cheese,Vitae ipsa molestias aut optio aut cum. Nisi doloribus dolor libero doloribus dolor veniam in quis. Omnis ut unde maiores dolores laborum repellat occaecati. Ratione et sint voluptatum.,https://source.unsplash.com/collection/1163637/100x100,563.768.193,true,Annette Handcrafted Metal Chicken,Chips
Colleen Intelligent Soft Pizza,Tuna,5,5,true,1755.00,  Ergonomic Tuna,Modi cupiditate officia exercitationem vel. Similique adipisci enim qui et amet blanditiis optio omnis. Eveniet et exercitationem magnam voluptatem architecto quam. Earum enim non.,https://source.unsplash.com/collection/1163637/100x100,929.341.607,true,Rahul Incredible Soft Chips,Cheese
Boris Intelligent Frozen Chair,Pizza,5,4,false,1907.00,  Incredible Pizza,Ratione occaecati ullam consectetur non expedita aliquid. Ut dolores magnam autem et vitae commodi ut qui pariatur. Fugit natus sint explicabo aliquam accusantium. Consequuntur illo dignissimos qui amet rerum.,https://source.unsplash.com/collection/1163637/100x100,950.603.385,true,Kara Ergonomic Cotton Shoes,Towels
Kylie Fantastic Plastic Cheese,Salad,5,3,false,1535.00,  Tasty Salad,Saepe velit nobis nihil praesentium consequatur distinctio. Unde autem assumenda nobis alias optio voluptas. Qui corporis eaque ut omnis sapiente rerum maxime architecto ut. Quia rerum cum neque. Ut sunt cumque accusamus veniam incidunt nostrum. Rem aut culpa cumque labore.,https://source.unsplash.com/collection/1163637/100x100,707.286.618,false,null,null
Rollin Small Metal Towels,Pizza,5,5,false,1601.00,  Incredible Pizza,Dolor odit dignissimos ut atque sed illum. Voluptatem iure perspiciatis nemo. Nisi et odio ut sunt laudantium ipsa corporis praesentium. Quibusdam sunt laborum qui eos maxime numquam repellat ut.,https://source.unsplash.com/collection/1163637/100x100,224.561.976,true,Bettie Rustic Cotton Car,Keyboard
