Nia Unbranded Steel Car,Pizza,4,1,true,1003.00,  Fantastic Pizza,Aut dolores minus et inventore neque ea. Vitae ex corporis. Qui recusandae est porro aspernatur magni minus facere aperiam nulla. Iste suscipit numquam et ullam explicabo voluptas ut consectetur ut. Et neque ut deleniti eaque voluptatibus rerum modi omnis. Quidem accusantium sed earum consequatur eos et aperiam cupiditate ex.,https://source.unsplash.com/collection/1163637/100x100,394.533.273,true,Austyn Awesome Frozen Shoes,Sausages
Deshawn Handmade Metal Keyboard,Shirt,3,4,true,1682.00,  Awesome Shirt,Et optio sed eius ut inventore temporibus quia. Aut pariatur temporibus possimus magni voluptatum exercitationem eligendi sunt. Ut et dolorem. Quisquam architecto repudiandae aut voluptas placeat sed. Omnis minus et tenetur temporibus. In autem molestiae aspernatur et.,https://source.unsplash.com/collection/1163637/100x100,168.918.503,true,Devante Sleek Concrete Soap,Shirt
Janelle Refined Metal Chicken,Bike,2,1,true,1071.00,  Gorgeous Bike,Neque aut nulla sequi dolor sint odit et. Esse qui ab quibusdam sit eveniet quasi in beatae. Dolore odio provident numquam et. Ullam et repellat. Corrupti debitis facilis iure magni enim numquam nesciunt nisi.,https://source.unsplash.com/collection/1163637/100x100,85.702.256,true,Colt Intelligent Metal Shoes,Salad
Eliezer Gorgeous Soft Chips,Fish,3,5,true,1719.00,  Practical Fish,Quos ut itaque atque libero rerum ut ut rerum. Eligendi est occaecati. Harum dolorum dolorem aperiam atque porro consequatur.,https://source.unsplash.com/collection/1163637/100x100,258.949.586,false,null,null
Allene Sleek Rubber Towels,Pants,3,2,true,1946.00,  Sleek Pants,Tenetur dolore illum repellendus nesciunt distinctio officiis distinctio sit vel. Ullam in maxime ab. Ipsum ut cumque quia ducimus. Aut repudiandae rerum aliquam veniam nostrum. Est est fugiat.,https://source.unsplash.com/collection/1163637/100x100,849.538.315,false,null,null
Billy Gorgeous Cotton Fish,Computer,4,1,false,1735.00,  Ergonomic Computer,Molestias occaecati qui asperiores possimus eum quae quas rerum quo. Eveniet laboriosam eos eum quia rerum. Eius officia et consequatur doloribus blanditiis et est unde nam. Aut dolorem exercitationem eveniet iure dolore earum.,https://source.unsplash.com/collection/1163637/100x100,676.315.97,false,null,null
Jordan Practical Soft Table,Bike,1,2,true,1239.00,  Generic Bike,Quia sapiente delectus aperiam nihil ratione voluptas. Accusamus quaerat quia corporis qui consequuntur natus praesentium. Velit inventore quia est inventore quia quis tempore omnis et. Hic sit optio neque. Cupiditate placeat et eum qui.,https://source.unsplash.com/collection/1163637/100x100,201.47.511,false,null,null
Johathan Incredible Fresh Chair,Table,3,4,true,1391.00,  Handcrafted Table,Voluptas consequatur nobis dolorem vero sed incidunt ratione nobis. Id ut aut aut laboriosam quasi. Ut et qui. Quia autem quis ipsum debitis quia qui sit. Qui rem magnam minus est asperiores id aliquid aut.,https://source.unsplash.com/collection/1163637/100x100,535.840.631,false,null,null
Terrill Handcrafted Plastic Chair,Car,4,4,false,1105.00,  Unbranded Car,Porro minima unde voluptatibus sequi sequi perferendis aut aut perferendis. Animi harum excepturi expedita. Cum qui rerum. Nihil sint vero illo ad placeat modi.,https://source.unsplash.com/collection/1163637/100x100,834.715.111,true,Lenna Intelligent Fresh Shirt,Computer
Shanelle Handcrafted Rubber Cheese,Chicken,4,3,true,1078.00,  Practical Chicken,Non vel dicta accusantium voluptatem molestiae et. Sed qui natus ut sed facilis. Voluptas magni corrupti placeat sit. Quis id nulla reiciendis sunt corporis. Facilis tenetur molestiae dolores laudantium sed qui aut.,https://source.unsplash.com/collection/1163637/100x100,864.373.174,true,Christopher Awesome Granite Hat,Pants
Joanne Incredible Wooden Hat,Gloves,1,5,false,1696.00,  Awesome Gloves,Reiciendis dignissimos laudantium. Excepturi facere est dolorem similique quae sint. Voluptas quam rem ratione sed. Qui aut modi quibusdam et dolores numquam fugit et. Provident adipisci harum ut vero.,https://source.unsplash.com/collection/1163637/100x100,675.973.355,false,null,null
Maymie Practical Wooden Bacon,Mouse,4,2,false,1524.00,  Tasty Mouse,Et natus beatae voluptates debitis dolor ut laudantium. Deserunt mollitia culpa. Corrupti minima voluptas accusantium repudiandae. In iste deleniti quisquam enim maxime iusto aut quod. Exercitationem aut est quidem. Incidunt odio corrupti vel.,https://source.unsplash.com/collection/1163637/100x100,409.503.833,false,null,null
Emerald Incredible Frozen Chips,Tuna,3,2,true,1371.00,  Handmade Tuna,Ad quasi nihil ipsam ducimus consectetur aut. Sint voluptas aut omnis voluptatem facere. Dolorem dolorem natus.,https://source.unsplash.com/collection/1163637/100x100,493.617.543,true,Kianna Small Soft Shirt,Pizza
Cleveland Intelligent Soft Ball,Gloves,3,4,false,1254.00,  Refined Gloves,Sunt sit vel. Fuga id accusantium ut. Blanditiis nobis aut. Et omnis at sunt.,https://source.unsplash.com/collection/1163637/100x100,747.565.493,true,Hermina Handcrafted Metal Soap,Pizza
Ford Awesome Plastic Ball,Bacon,2,5,false,1238.00,  Handcrafted Bacon,Aut architecto alias quasi. Ut recusandae suscipit eos. Dolor consequatur aut delectus soluta consequuntur iste blanditiis occaecati nisi. Praesentium ut harum dolor est illo sint consequatur sed autem. Laudantium dolores voluptatibus excepturi perferendis adipisci suscipit.,https://source.unsplash.com/collection/1163637/100x100,868.739.710,true,Casimir Small Fresh Chips,Computer
Miguel Unbranded Granite Fish,Hat,2,4,false,1421.00,  Intelligent Hat,Nam ex et totam id suscipit sit eveniet quae rerum. Distinctio iste fugit. Et consequatur est. Beatae aut et aut cumque facere magni fuga est. Unde ut quis. Delectus rerum harum animi officia qui quia sunt ab.,https://source.unsplash.com/collection/1163637/100x100,435.652.832,false,null,null
Margret Intelligent Rubber Tuna,Towels,2,4,true,1640.00,  Incredible Towels,Ipsam unde nobis autem laborum dolorum itaque non velit. Velit vero repellat. In laboriosam sunt sequi.,https://source.unsplash.com/collection/1163637/100x100,194.709.765,true,Eveline Awesome Frozen Chicken,Computer
Viva Incredible Soft Bacon,Salad,4,5,true,1659.00,  Practical Salad,Illum assumenda ut suscipit voluptatem illo omnis. Ut corporis fuga vel quasi qui in. Et voluptatem alias.,https://source.unsplash.com/collection/1163637/100x100,215.222.886,true,Alaina Gorgeous Plastic Tuna,Table
Leonardo Generic Metal Mouse,Pants,3,4,false,1390.00,  Licensed Pants,Aut illo voluptatem ut ut praesentium. Accusantium explicabo quaerat quos. Assumenda dolorem animi sunt sint facere cumque sunt quod perspiciatis. In temporibus ut voluptatem commodi necessitatibus voluptas hic cupiditate veritatis. Nihil maiores doloribus. Provident voluptatibus corrupti ratione vitae quas sed et.,https://source.unsplash.com/collection/1163637/100x100,470.137.673,true,Walter Refined Granite Hat,Chicken
Rebeca Intelligent Steel Fish,Sausages,4,4,false,1491.00,  Intelligent Sausages,In nemo ut. Nulla qui quia reiciendis minima qui magnam. Omnis at nihil et pariatur magnam illo dicta saepe est. Molestiae at atque molestiae eaque sed.,https://source.unsplash.com/collection/1163637/100x100,239.193.137,true,Wilton Tasty Wooden Cheese,Ball
Macey Incredible Plastic Mouse,Pants,2,1,false,1294.00,  Small Pants,Quis exercitationem modi quisquam nihil. Amet maiores fugiat qui non rerum tempore numquam consequatur cum. Aperiam suscipit unde. Ipsam voluptas quis quia atque enim eum sunt ipsam.,https://source.unsplash.com/collection/1163637/100x100,5.313.512,true,Camila Practical Fresh Hat,Bacon
Garland Tasty Soft Chips,Shoes,4,5,false,1813.00,  Incredible Shoes,Eaque velit laboriosam officia vel et voluptas et repudiandae. Ut cum eos vitae explicabo placeat distinctio quibusdam. Accusantium molestiae consequatur voluptatibus suscipit.,https://source.unsplash.com/collection/1163637/100x100,496.125.481,false,null,null
Eileen Small Wooden Shirt,Table,1,2,false,1750.00,  Small Table,Iste est excepturi excepturi. Cumque mollitia aut omnis. Fuga assumenda impedit incidunt nisi. Quibusdam quidem dolorem voluptatibus voluptatem suscipit. Corrupti deleniti ratione neque sunt aperiam quo.,https://source.unsplash.com/collection/1163637/100x100,713.440.61,false,null,null
Whitney Intelligent Concrete Sausages,Chair,1,5,true,1085.00,  Rustic Chair,Fuga minima omnis facilis non debitis. Dolores fugiat incidunt cumque. Earum quia veniam possimus. Omnis et expedita molestias tenetur quasi asperiores suscipit. Fuga fuga voluptatem est ab ea.,https://source.unsplash.com/collection/1163637/100x100,960.455.310,true,Kane Intelligent Soft Soap,Table
Etha Incredible Frozen Chicken,Chair,4,2,false,1643.00,  Intelligent Chair,Unde commodi dolor aut nesciunt voluptatum. Fuga quod sint inventore eligendi magni tempora dolorem non ipsam. Iste totam quos quidem reprehenderit ut et.,https://source.unsplash.com/collection/1163637/100x100,711.78.634,true,Missouri Unbranded Steel Tuna,Shoes
Joana Rustic Concrete Fish,Cheese,3,3,false,1372.00,  Ergonomic Cheese,Est officia occaecati placeat illum. Dolorem minima ut iste natus sit qui. Autem saepe sint non consequatur quia deleniti quaerat aut. Consectetur commodi neque perspiciatis.,https://source.unsplash.com/collection/1163637/100x100,370.35.831,true,Haskell Fantastic Concrete Bacon,Fish
Meda Fantastic Granite Bike,Car,3,2,false,1701.00,  Handcrafted Car,Quos officiis consequatur. Veniam est praesentium dolorem. Et omnis nemo excepturi voluptatem at nemo quod quis.,https://source.unsplash.com/collection/1163637/100x100,765.612.457,true,Marcellus Tasty Cotton Computer,Sausages
Kaleb Gorgeous Plastic Towels,Bike,4,4,false,1692.00,  Awesome Bike,Asperiores cumque ad earum voluptatem voluptatibus. Ea ut est explicabo nemo ut veniam. Voluptate incidunt amet sunt explicabo iste tempora ut aut.,https://source.unsplash.com/collection/1163637/100x100,973.268.91,true,Makenzie Generic Soft Tuna,Shoes
Shaylee Practical Steel Ball,Towels,4,3,false,1507.00,  Practical Towels,Architecto iusto at qui beatae. Est totam odit in fuga. Est ut et ut voluptates rerum facilis exercitationem ducimus. Est voluptatibus doloribus perspiciatis distinctio iusto provident dolor ipsum. Sit quasi omnis facere eum id. Excepturi ex aut voluptatem consequuntur rerum.,https://source.unsplash.com/collection/1163637/100x100,970.967.148,true,Emery Generic Soft Computer,Hat
Ally Handmade Metal Fish,Bike,1,1,true,1231.00,  Handmade Bike,Cum corrupti labore et ducimus beatae. Dolorum occaecati exercitationem veritatis iure quos repudiandae quam ullam sed. Ea omnis vel consequatur nobis vel sunt maiores. Delectus natus eos.,https://source.unsplash.com/collection/1163637/100x100,371.112.372,true,Mckenzie Unbranded Soft Pants,Cheese
Alexys Unbranded Wooden Salad,Chicken,2,1,false,1451.00,  Tasty Chicken,Natus cumque hic. Sunt ad nisi consectetur repudiandae eos. Reiciendis dolor et ad hic. Eveniet corrupti quia aspernatur quibusdam omnis. Atque explicabo voluptatibus similique provident.,https://source.unsplash.com/collection/1163637/100x100,817.768.666,false,null,null
Kendra Licensed Metal Fish,Computer,2,2,false,1670.00,  Practical Computer,Vel vel nobis vitae eos in molestiae atque. Odit velit aut enim natus porro magnam voluptatem. Adipisci eos et labore. Repellat et ut deserunt eligendi vel ut nisi enim. Qui enim aut error est doloribus impedit in assumenda impedit. Numquam eaque aperiam vitae recusandae porro et.,https://source.unsplash.com/collection/1163637/100x100,335.333.367,true,Sharon Intelligent Fresh Cheese,Soap
Zora Handmade Granite Towels,Tuna,3,2,false,1629.00,  Gorgeous Tuna,Velit aliquid dolorem ipsa eum. Et veritatis dolores id temporibus maiores nemo incidunt itaque. Ex quia ipsum. Perferendis minus repudiandae nemo delectus. Molestiae expedita eum omnis autem. Inventore pariatur ducimus quidem.,https://source.unsplash.com/collection/1163637/100x100,147.537.176,true,Emilio Intelligent Metal Table,Cheese
Wilhelmine Small Frozen Bacon,Pizza,4,4,false,1589.00,  Sleek Pizza,Aut eum dolores. Dolorem tempora quo quis nemo ratione. Velit quae quia doloribus voluptas libero. Vel ut tempora dolorem beatae dolores accusamus.,https://source.unsplash.com/collection/1163637/100x100,407.830.790,true,Treva Sleek Soft Table,Shoes
Elisa Tasty Granite Salad,Towels,1,3,false,1719.00,  Awesome Towels,Dolores in a aliquid et amet modi consectetur vel ratione. Minus eveniet qui nobis suscipit excepturi. Neque nam maxime modi culpa rerum ut totam et quasi. Dignissimos delectus blanditiis blanditiis officia qui provident dicta tempora.,https://source.unsplash.com/collection/1163637/100x100,886.343.39,true,Augustine Licensed Plastic Computer,Shoes
Eulalia Ergonomic Fresh Mouse,Table,3,3,false,1849.00,  Tasty Table,Id excepturi voluptatum culpa saepe eligendi id similique. Labore illo officia maiores beatae rerum fugit excepturi. Ut maiores dolore facere repudiandae sint quia numquam. Aut minus deleniti ut mollitia. Aperiam voluptate possimus eveniet est quas beatae ut sint incidunt.,https://source.unsplash.com/collection/1163637/100x100,460.678.656,false,null,null
Ervin Small Soft Cheese,Chair,5,1,true,1078.00,  Small Chair,Itaque magni consequatur fugiat illo aspernatur delectus nihil autem. Ut et ut magni molestiae nemo. Eum sed quod. Eum magnam et exercitationem nihil omnis. Veritatis deleniti aut autem esse harum et officia. Voluptatibus rerum saepe magnam culpa consequuntur ut excepturi aliquam id.,https://source.unsplash.com/collection/1163637/100x100,604.97.589,true,Destini Unbranded Fresh Towels,Mouse
Mose Sleek Metal Fish,Tuna,1,2,false,1908.00,  Refined Tuna,Aut et rem mollitia voluptatibus quis qui. Impedit in pariatur fugiat incidunt voluptate est quod. Corporis repellendus sequi dolorem quia esse voluptas. Ipsam eos excepturi beatae excepturi iste. Distinctio minus aliquid vel quis accusantium qui non. Sit ratione tempora fugit unde.,https://source.unsplash.com/collection/1163637/100x100,899.390.508,false,null,null
Erick Intelligent Steel Bike,Sausages,5,2,true,1122.00,  Intelligent Sausages,Distinctio molestiae aut sapiente. Voluptates molestiae delectus amet. Ratione rem voluptatem libero praesentium quam. Ducimus hic rerum eligendi tempora eos qui ea. Ut quae et nostrum dolorem ad hic.,https://source.unsplash.com/collection/1163637/100x100,246.205.591,false,null,null
Joan Small Steel Tuna,Hat,5,4,false,1452.00,  Incredible Hat,Aliquam accusamus nam dolores labore facilis. Recusandae alias distinctio reprehenderit et repellat magni. Recusandae voluptatem dignissimos officiis maiores dolores non voluptas nisi.,https://source.unsplash.com/collection/1163637/100x100,218.789.955,false,null,null
Arnoldo Handcrafted Soft Gloves,Sausages,2,2,true,1748.00,  Fantastic Sausages,Et velit qui repudiandae sequi doloremque incidunt. Rerum provident quo. Distinctio ipsam deleniti et autem sed sed accusantium voluptate.,https://source.unsplash.com/collection/1163637/100x100,343.357.442,false,null,null
Lysanne Ergonomic Granite Salad,Pizza,5,3,true,1275.00,  Handmade Pizza,Explicabo similique qui sunt et doloribus molestias nisi dicta. Blanditiis sint architecto illum aut. Enim quis alias minima ex et ea et quidem fugit. Ipsa consequuntur nihil suscipit rerum aut libero numquam minus.,https://source.unsplash.com/collection/1163637/100x100,964.344.580,false,null,null
Orland Sleek Rubber Computer,Towels,3,3,true,1223.00,  Tasty Towels,Non non officiis consequuntur. Rerum ut dolores maiores quisquam. Sint perferendis enim consectetur. Temporibus distinctio explicabo pariatur. Qui reprehenderit sed in suscipit minus. Culpa quis fugit nisi accusamus.,https://source.unsplash.com/collection/1163637/100x100,779.777.84,false,null,null
Karen Practical Wooden Salad,Bike,5,5,true,1201.00,  Awesome Bike,Est autem optio voluptates consequuntur dolorem minus. Deleniti est autem quia ut vel odio. Sapiente eaque ut esse ipsa est voluptatibus repellendus. Sunt impedit enim sit veritatis. Quam iusto itaque molestiae ea maiores qui dolorem. Voluptas hic aut veritatis ab accusantium quo.,https://source.unsplash.com/collection/1163637/100x100,987.600.842,true,Alvena Incredible Fresh Shoes,Car
Cordell Licensed Concrete Towels,Bike,2,5,false,1024.00,  Awesome Bike,Sunt debitis voluptatibus dolor incidunt error consequatur quia. Sint nostrum sit. Est ex possimus. Praesentium voluptas laudantium at. Earum est quibusdam qui eos pariatur labore.,https://source.unsplash.com/collection/1163637/100x100,802.988.438,true,Virgil Incredible Metal Bike,Towels
Paige Generic Frozen Tuna,Soap,4,5,true,1760.00,  Awesome Soap,Qui quis dolorem labore saepe sapiente. Tempora ex molestiae vero commodi enim omnis deleniti possimus voluptate. Animi nisi ex.,https://source.unsplash.com/collection/1163637/100x100,76.737.848,true,Alize Gorgeous Metal Fish,Chicken
Jenifer Handcrafted Rubber Pizza,Chair,1,2,true,1268.00,  Intelligent Chair,Tempore nihil sit voluptatem vel quia. Vero placeat aut provident laborum magni enim. Ipsa aperiam dicta eos delectus.,https://source.unsplash.com/collection/1163637/100x100,980.65.696,true,Lorenza Licensed Concrete Table,Keyboard
Frieda Refined Steel Pizza,Sausages,1,4,false,1099.00,  Generic Sausages,Possimus saepe tempore nihil facere ullam blanditiis et. Neque vel natus similique. Soluta quas autem perferendis facilis. Aliquid dolorum aut.,https://source.unsplash.com/collection/1163637/100x100,520.439.949,false,null,null
Xzavier Small Fresh Keyboard,Bike,5,2,false,1358.00,  Generic Bike,Consequatur ex ducimus ut non natus ab. Itaque nulla molestiae cupiditate sunt necessitatibus corporis architecto consequatur. Odit aspernatur fugiat quia quibusdam consequatur.,https://source.unsplash.com/collection/1163637/100x100,555.523.437,true,Flavie Handmade Fresh Mouse,Salad
Bertrand Small Cotton Gloves,Car,1,1,false,1792.00,  Refined Car,Consequatur aut necessitatibus animi. Aut minus laboriosam voluptas rerum odit veritatis eos. Ut alias amet officia aut repellendus aliquid iure.,https://source.unsplash.com/collection/1163637/100x100,260.447.466,true,Sally Handmade Soft Salad,Chair
Maryjane Practical Plastic Salad,Soap,1,4,false,1017.00,  Licensed Soap,Consequatur atque maiores odit et deserunt quis. Quam odio officia dolorum veniam nihil veritatis nesciunt. Consequuntur maiores sint quis vitae quia nam aut.,https://source.unsplash.com/collection/1163637/100x100,457.198.170,true,David Ergonomic Concrete Shoes,Chips
Annabel Intelligent Plastic Fish,Tuna,2,4,false,1769.00,  Rustic Tuna,Velit iste optio neque hic voluptas facere laborum. Sint beatae rerum distinctio ut velit. Necessitatibus tempora quisquam autem recusandae.,https://source.unsplash.com/collection/1163637/100x100,839.659.790,false,null,null
Frida Ergonomic Rubber Mouse,Shirt,2,5,true,1571.00,  Small Shirt,Libero incidunt aut eum nobis. Et impedit ut velit. Fugiat impedit fugit voluptatem. Accusamus explicabo dicta ad similique molestiae velit. Perferendis est quisquam aut veritatis qui doloribus.,https://source.unsplash.com/collection/1163637/100x100,658.349.412,true,Chelsey Intelligent Fresh Bacon,Tuna
Griffin Refined Cotton Chicken,Hat,5,3,true,1012.00,  Awesome Hat,Expedita est occaecati beatae autem asperiores ab. Sunt deserunt in error molestias quaerat totam eos quaerat. Non vero sint illum quibusdam voluptatem. Maxime ipsa maxime dolor omnis id. Ullam iusto dolore delectus. Velit eos tempore.,https://source.unsplash.com/collection/1163637/100x100,736.155.36,false,null,null
Pedro Intelligent Rubber Shoes,Tuna,3,3,false,1037.00,  Refined Tuna,Voluptatem repudiandae at cum veritatis autem. Est quia maxime ratione sequi aut et. Et voluptatem voluptas doloremque. Libero sed error.,https://source.unsplash.com/collection/1163637/100x100,815.748.209,true,Francis Tasty Cotton Pants,Shoes
Davon Tasty Soft Sausages,Chicken,2,2,false,1788.00,  Rustic Chicken,Voluptate in hic ut laudantium voluptates quia expedita odit minima. Et praesentium qui et consequatur. Deserunt et quod consequatur magni laborum.,https://source.unsplash.com/collection/1163637/100x100,452.716.993,true,Morgan Refined Rubber Fish,Bike
Agustin Incredible Frozen Pants,Chips,1,1,false,1077.00,  Handmade Chips,Enim ut voluptas error tenetur animi quia. Occaecati est sed eum illo nisi. Consequuntur repellat ut voluptatibus error. Consectetur ad a rem iusto maiores facere corrupti non. Deleniti maiores esse exercitationem dolore et autem sequi expedita nihil.,https://source.unsplash.com/collection/1163637/100x100,565.648.410,true,Deangelo Handmade Concrete Keyboard,Chips
Loyal Small Plastic Chair,Soap,1,4,false,1029.00,  Tasty Soap,Et sint dolores dolorem temporibus dignissimos. Ratione beatae sint assumenda. Quia nihil et illo quis cumque quaerat. Voluptate quidem rerum velit. Qui a cupiditate est. Impedit ut non.,https://source.unsplash.com/collection/1163637/100x100,607.141.95,false,null,null
Filomena Awesome Fresh Cheese,Tuna,5,5,false,1178.00,  Ergonomic Tuna,Sequi temporibus architecto praesentium recusandae voluptas. Et suscipit repudiandae ut. Nihil voluptatem deserunt et non et ad. Maxime alias tempore recusandae qui quia fugiat.,https://source.unsplash.com/collection/1163637/100x100,196.274.278,true,Rudolph Ergonomic Plastic Fish,Shoes
Arturo Unbranded Concrete Tuna,Chair,5,2,true,1602.00,  Handmade Chair,Ut suscipit laboriosam quam blanditiis quia ut quos. Magni possimus dolor iste aspernatur. Veritatis illum voluptatibus eveniet et. Quis quia maxime. Corrupti quia magni at blanditiis similique eligendi. Nisi vel ipsum magni.,https://source.unsplash.com/collection/1163637/100x100,861.991.270,true,Javonte Small Cotton Gloves,Bike
Peggie Tasty Concrete Salad,Salad,2,3,true,1703.00,  Practical Salad,Doloribus et vel eos vero magni dolore excepturi. Nostrum non doloremque. Esse sit est placeat quis perspiciatis labore excepturi voluptates.,https://source.unsplash.com/collection/1163637/100x100,24.860.978,true,Prudence Sleek Cotton Fish,Bike
Miguel Handcrafted Rubber Hat,Cheese,2,1,true,1535.00,  Tasty Cheese,Impedit consequatur quia dolorem enim esse fugiat iste. Commodi qui consectetur dignissimos ut est minima omnis ut. Deleniti tempora voluptatem. Debitis mollitia aperiam dolor facilis cupiditate non esse commodi consequatur.,https://source.unsplash.com/collection/1163637/100x100,234.915.483,true,Alfonso Sleek Plastic Sausages,Shirt
Marina Refined Plastic Sausages,Salad,1,2,true,1362.00,  Generic Salad,Voluptas ut quas debitis qui laborum ipsum hic. Architecto autem saepe qui dolorem. Aut saepe laudantium consequatur dignissimos modi ex dolor. Aut et voluptatem.,https://source.unsplash.com/collection/1163637/100x100,813.822.699,true,Erling Unbranded Cotton Soap,Gloves
Ari Tasty Cotton Sausages,Hat,2,4,false,1458.00,  Ergonomic Hat,Eos sit hic pariatur harum. Velit aut illum amet laborum iusto nulla delectus sed. Praesentium aut corrupti aliquid sed nam praesentium. Enim eveniet sapiente dolore dolores facilis ut. Quidem qui eaque dolorem omnis omnis vel repellendus expedita culpa.,https://source.unsplash.com/collection/1163637/100x100,960.0.200,false,null,null
Halle Handcrafted Metal Pants,Pants,4,5,false,1459.00,  Awesome Pants,Dolores quo rerum aspernatur fugiat. Tempora velit a eos delectus eligendi est rerum eius. Iusto velit quasi exercitationem nihil recusandae autem doloremque consequatur.,https://source.unsplash.com/collection/1163637/100x100,179.989.360,false,null,null
Sibyl Tasty Granite Bacon,Shirt,5,4,false,1357.00,  Awesome Shirt,Accusantium magni dolore molestiae exercitationem voluptate autem. Corrupti repudiandae rerum debitis sed rerum incidunt nostrum et nobis. Pariatur rerum eius est quia. Placeat consequatur quo dolore nesciunt et aperiam molestias. Enim dolores blanditiis repellat harum dolor suscipit quae.,https://source.unsplash.com/collection/1163637/100x100,750.958.768,true,Raul Generic Plastic Sausages,Cheese
Dario Rustic Concrete Bike,Fish,1,1,false,1134.00,  Unbranded Fish,Expedita repudiandae voluptate cum tempore velit maiores amet. Mollitia quis sed. Magni qui est quibusdam beatae. Officia voluptate aut aut impedit sunt tempora ipsam.,https://source.unsplash.com/collection/1163637/100x100,365.326.50,false,null,null
Felicity Practical Metal Bike,Salad,3,4,true,1047.00,  Unbranded Salad,Vero ut deleniti deserunt. Maxime tempore dolorem. Molestiae sunt temporibus delectus dignissimos id et.,https://source.unsplash.com/collection/1163637/100x100,816.281.502,true,Alvena Rustic Steel Chips,Hat
Roman Incredible Metal Keyboard,Pizza,2,2,false,1316.00,  Incredible Pizza,Aut qui facere saepe. Voluptatem quis iste nesciunt consectetur ut aut quod nisi optio. Voluptas est officia. Corrupti reiciendis facere repellendus nostrum. Rerum tempore architecto. Laborum nobis est in.,https://source.unsplash.com/collection/1163637/100x100,411.461.159,false,null,null
Triston Small Frozen Pants,Bike,1,4,false,1656.00,  Awesome Bike,Veritatis harum nostrum aut quis error commodi qui id quia. Ut corporis rerum sunt provident. Est qui facilis ut id. Numquam odit eaque distinctio. Pariatur velit officiis velit minus nihil fuga.,https://source.unsplash.com/collection/1163637/100x100,859.760.305,true,Arnoldo Rustic Cotton Car,Chips
Retha Ergonomic Frozen Car,Shirt,3,4,true,1705.00,  Refined Shirt,Assumenda aut ea amet. Laborum hic nostrum dolores quia. Laborum rerum error. Ut quidem dolores magni dolor. Occaecati laudantium praesentium esse temporibus et asperiores.,https://source.unsplash.com/collection/1163637/100x100,882.682.522,false,null,null
