Cole Refined Soft Bacon,Soap,2,4,false,1950.00,  Incredible Soap,Repellat tenetur autem in. Iusto magni in eaque autem ratione vero. Vitae optio reprehenderit doloremque repellat iure sint ipsam omnis rerum. Maxime voluptates ea dolore. Inventore accusantium quod laudantium asperiores provident eveniet.,https://source.unsplash.com/collection/1163637/100x100,219.350.497,false,null,null
Javon Sleek Fresh Soap,Cheese,3,3,false,1593.00,  Refined Cheese,Officiis iusto fuga maxime suscipit nulla odit iure vel. Eius blanditiis qui necessitatibus maiores commodi asperiores. Tenetur et aut dolore laboriosam maxime illum quis rerum velit.,https://source.unsplash.com/collection/1163637/100x100,944.812.109,false,null,null
Sophie Handmade Metal Computer,Ball,3,5,false,1846.00,  Handmade Ball,Quam porro voluptatem nisi ad in iste ea. Adipisci labore necessitatibus itaque adipisci neque ea. Ratione consequuntur dolorem. Deserunt sed labore ducimus tempora ratione quo quae. Magnam ducimus eligendi quaerat dolores natus.,https://source.unsplash.com/collection/1163637/100x100,256.576.189,true,Eriberto Small Granite Chicken,Car
Nelson Licensed Rubber Cheese,Fish,1,2,false,1088.00,  Gorgeous Fish,Dolorum quam quod consequatur itaque at ut fugit beatae ut. Perferendis eum velit est et labore dolorem velit. Quis iusto eligendi rerum qui eius dolorem id. Sunt libero minus id nobis quo autem quas facere. Deleniti id sit nam officia fuga. Placeat pariatur beatae culpa reiciendis modi aut facilis.,https://source.unsplash.com/collection/1163637/100x100,778.146.687,false,null,null
Joaquin Generic Rubber Computer,Towels,3,1,false,1079.00,  Sleek Towels,Enim quas quos facere eos alias facilis. Quo autem soluta nam. Id architecto id minima minus aut doloribus cupiditate quia odit. Dolores rerum sit quo officiis officiis aperiam omnis facere. Assumenda ea quia consequatur aut vel sit iusto ullam.,https://source.unsplash.com/collection/1163637/100x100,949.237.94,true,Eli Ergonomic Frozen Keyboard,Bacon
Julio Handcrafted Frozen Chair,Pizza,4,3,false,1291.00,  Sleek Pizza,In cupiditate incidunt ab. Vel et vel maiores qui. Ut hic aliquam quasi et cum provident minus dolores. Id quisquam possimus rerum. Autem ab architecto quia. Ea rerum pariatur beatae quis optio soluta exercitationem perspiciatis.,https://source.unsplash.com/collection/1163637/100x100,392.262.644,true,Kaelyn Handcrafted Wooden Pizza,Chips
Jaeden Unbranded Metal Fish,Hat,3,4,true,1441.00,  Ergonomic Hat,Aspernatur quas dolor et asperiores quia necessitatibus architecto. Sit praesentium aut dolorum. Sed qui eos voluptatibus aperiam vitae.,https://source.unsplash.com/collection/1163637/100x100,247.3.126,true,Marianne Incredible Metal Chicken,Mouse
Dandre Handcrafted Plastic Cheese,Ball,2,3,true,1642.00,  Small Ball,Et quis aperiam. Sit quis rerum. Deserunt est in asperiores ut voluptatem. Quis quis porro eos repellendus dolor ut ut animi.,https://source.unsplash.com/collection/1163637/100x100,904.275.534,true,Charley Practical Cotton Table,Bacon
Loy Incredible Cotton Table,Gloves,3,2,true,1560.00,  Tasty Gloves,Officiis vero repudiandae aut consequuntur eaque debitis quibusdam. Architecto quis soluta fugit cum accusantium odio ab. Reprehenderit aut aut labore quia aut ut aut porro reprehenderit. Aperiam non cupiditate placeat. Ratione aperiam culpa amet qui natus sed expedita.,https://source.unsplash.com/collection/1163637/100x100,134.550.616,true,Payton Intelligent Plastic Chips,Ball
Jimmie Refined Concrete Gloves,Pizza,2,3,true,1990.00,  Gorgeous Pizza,Adipisci ex quae in qui quae error cumque iusto. Dignissimos ratione voluptas accusantium aperiam laudantium sed amet. Quidem minima iste quis unde eius nulla odio.,https://source.unsplash.com/collection/1163637/100x100,367.998.126,true,Guido Licensed Fresh Table,Bacon
Annabell Tasty Fresh Hat,Salad,4,3,true,1853.00,  Tasty Salad,Eligendi animi distinctio esse placeat maiores. Omnis architecto voluptas iusto. Molestiae eos veritatis cumque qui et. Tenetur enim ratione culpa quaerat asperiores molestias amet illum. Id et quisquam et architecto eos non dignissimos qui.,https://source.unsplash.com/collection/1163637/100x100,688.674.763,false,null,null
Melany Generic Cotton Pizza,Hat,1,5,false,1096.00,  Small Hat,Vero libero deleniti molestiae quia iste dolores et. Architecto ipsa doloribus fuga ut velit quos sit. Et officia provident. Doloremque corrupti molestiae perspiciatis ex id velit rerum in.,https://source.unsplash.com/collection/1163637/100x100,68.474.639,true,Craig Generic Metal Computer,Bike
Judah Licensed Granite Car,Computer,4,4,true,1833.00,  Ergonomic Computer,Aspernatur voluptate atque voluptates fuga vel consectetur et est. Aut autem cupiditate et quo maiores quae saepe autem. Quia quasi saepe et. Alias autem eius eveniet necessitatibus deleniti. Quia sint exercitationem sed sed.,https://source.unsplash.com/collection/1163637/100x100,336.889.517,true,Jayce Handcrafted Steel Fish,Bacon
Rowland Tasty Plastic Mouse,Gloves,3,4,false,1200.00,  Licensed Gloves,Voluptatem soluta dignissimos sint. Sit rerum aut minima ipsam itaque qui est. Voluptatem excepturi laborum veritatis.,https://source.unsplash.com/collection/1163637/100x100,624.206.997,true,Meredith Generic Cotton Computer,Keyboard
Silas Refined Frozen Hat,Towels,4,1,true,1426.00,  Tasty Towels,Inventore aperiam et reiciendis quos quae est nobis magnam debitis. Voluptas eum necessitatibus aspernatur quia aliquid. At architecto et nemo. Sint natus sapiente laborum quo accusantium ut libero est qui. Voluptas autem quia sit.,https://source.unsplash.com/collection/1163637/100x100,340.926.828,true,Steve Incredible Frozen Keyboard,Salad
Ricky Incredible Frozen Computer,Shoes,4,3,true,1410.00,  Sleek Shoes,Nulla odio odio quia animi veniam maiores. Molestias qui reiciendis velit nam. Voluptatibus voluptatem fuga illo nihil quod quis nesciunt natus illum. Commodi est eius dignissimos amet et beatae deleniti vitae mollitia. Nemo labore non sit provident.,https://source.unsplash.com/collection/1163637/100x100,387.741.480,false,null,null
Kaleigh Licensed Frozen Mouse,Chair,3,2,false,1891.00,  Practical Chair,Officia et rerum est neque. Ut dolor occaecati nostrum veniam. Quisquam aut et id. Eos magni quia nostrum. Delectus dolores sit natus architecto ab.,https://source.unsplash.com/collection/1163637/100x100,337.279.617,false,null,null
Haylee Small Rubber Ball,Shirt,1,1,false,1348.00,  Practical Shirt,Deleniti aliquam eaque facere consequatur dolores iusto. Temporibus maxime id tempore. Similique qui facilis modi assumenda corrupti odio. Et minima saepe. Deleniti ipsam dolores debitis repudiandae modi. Rerum optio quae aspernatur cumque impedit consectetur eum id nostrum.,https://source.unsplash.com/collection/1163637/100x100,284.778.503,false,null,null
Johann Licensed Fresh Soap,Chair,3,3,true,1303.00,  Unbranded Chair,Sunt nihil quibusdam assumenda recusandae adipisci culpa omnis necessitatibus qui. Est odit quaerat nihil rem qui. Quod amet aut maiores. Distinctio aut saepe nihil error laudantium recusandae.,https://source.unsplash.com/collection/1163637/100x100,421.812.956,true,Gwendolyn Refined Metal Shirt,Mouse
Morgan Licensed Frozen Computer,Hat,2,1,true,1332.00,  Small Hat,Nihil quasi iure consequatur quia ea tenetur. Sunt omnis in. Quasi ut commodi illum ipsa atque. Tempora est sed minus rerum aliquid. Ipsum mollitia qui occaecati debitis beatae soluta. Ut aspernatur nisi omnis dolores quia quisquam ex pariatur eos.,https://source.unsplash.com/collection/1163637/100x100,704.116.488,true,Yasmeen Incredible Plastic Tuna,Fish
Jeffery Small Fresh Bacon,Tuna,5,4,true,1807.00,  Sleek Tuna,Eius fuga voluptates rerum nisi dignissimos pariatur eum consequatur quia. Ea quia et aut alias nisi quaerat dolorem. Qui ut aut tenetur possimus ab totam eaque. Et et sunt quos sit. Reiciendis sit praesentium ex quis et sequi.,https://source.unsplash.com/collection/1163637/100x100,17.743.314,false,null,null
Damien Sleek Soft Shirt,Bacon,1,3,true,1988.00,  Awesome Bacon,Fugiat nihil officia. Ducimus temporibus repellendus numquam quisquam aliquam aut. Qui nobis molestiae harum quo porro provident accusamus quisquam. Repudiandae dolore qui nihil tempore provident ea totam nemo. In sed laboriosam accusamus similique architecto officiis ipsam assumenda in. Voluptates dolores rerum sint voluptatem et est impedit.,https://source.unsplash.com/collection/1163637/100x100,712.327.326,false,null,null
Bailee Awesome Rubber Mouse,Chair,2,2,false,1071.00,  Handcrafted Chair,Et natus repudiandae omnis sint vel corporis deserunt explicabo. Ipsum aut consectetur quam ut et. Eligendi ab totam quod. Aut maxime natus officia consectetur et minima est fugiat et. Explicabo recusandae id ea soluta totam est hic.,https://source.unsplash.com/collection/1163637/100x100,26.129.831,true,Dolly Ergonomic Metal Hat,Mouse
Teresa Licensed Soft Shoes,Shoes,4,1,false,1271.00,  Tasty Shoes,Cumque rerum dicta. Perspiciatis nobis mollitia est. Dolor hic totam optio et sed rem.,https://source.unsplash.com/collection/1163637/100x100,393.62.900,true,Precious Licensed Rubber Chicken,Chicken
Liliana Intelligent Steel Mouse,Car,5,1,false,1566.00,  Fantastic Car,Aut sequi aut fugiat et sint consectetur et. A id modi eum atque minus suscipit veniam itaque eum. Dolores nihil sed fugit quis aut est illo omnis et.,https://source.unsplash.com/collection/1163637/100x100,11.447.230,true,Odie Handmade Soft Gloves,Chips
Sigmund Small Granite Chips,Bacon,4,5,true,1329.00,  Rustic Bacon,Laudantium aliquam omnis sed voluptas. Sit expedita cum harum et numquam quasi. Magni nam natus asperiores optio perferendis. Incidunt qui omnis et iste aut quia.,https://source.unsplash.com/collection/1163637/100x100,764.803.122,true,Emilio Rustic Cotton Pizza,Salad
Dakota Refined Cotton Computer,Salad,1,3,true,1068.00,  Handcrafted Salad,Pariatur modi rerum aut dicta sunt aut iusto architecto. Iusto magnam iusto et veniam neque tempore occaecati. Animi aut magni maxime.,https://source.unsplash.com/collection/1163637/100x100,520.745.369,false,null,null
Emerald Refined Fresh Mouse,Ball,4,4,false,1538.00,  Intelligent Ball,Dolore consequatur voluptatem cumque fuga assumenda facere sed aut. Corrupti aspernatur blanditiis. Voluptatem fuga ut quaerat qui explicabo harum esse voluptatem. Quae laborum non eos quisquam voluptates error quia. Voluptas dolor dolorum eligendi dolorum nemo qui.,https://source.unsplash.com/collection/1163637/100x100,722.553.414,true,Dedrick Handcrafted Concrete Cheese,Table
Matilda Awesome Rubber Ball,Car,3,5,false,1371.00,  Handcrafted Car,Nam voluptatem et et ducimus voluptas. Dolorem perferendis qui laborum laudantium soluta. Quia at temporibus nihil eos. Velit qui corporis neque debitis.,https://source.unsplash.com/collection/1163637/100x100,953.149.617,true,Roderick Handmade Rubber Hat,Ball
Sid Handcrafted Fresh Chicken,Pizza,5,4,true,1442.00,  Intelligent Pizza,Et repellendus veritatis facere qui quam eius laboriosam sint et. Blanditiis at distinctio occaecati ratione occaecati ut. Et inventore quia odit. Labore velit aut error aut temporibus minus ut.,https://source.unsplash.com/collection/1163637/100x100,217.526.184,true,Janiya Licensed Concrete Bacon,Tuna
Xander Incredible Concrete Cheese,Keyboard,2,2,true,1227.00,  Handmade Keyboard,Consequatur numquam asperiores omnis voluptatum voluptas. Facilis tempora repellat reiciendis eos nihil quas vitae. Repellendus velit minus ut aspernatur occaecati sit ut aut. Accusantium exercitationem necessitatibus odio repellat veniam quos magnam magni. Recusandae soluta officiis debitis pariatur quia. Sapiente et repellat tempore rerum.,https://source.unsplash.com/collection/1163637/100x100,310.948.16,true,Dandre Refined Soft Shirt,Sausages
Earline Small Concrete Shirt,Bacon,1,3,false,1702.00,  Handmade Bacon,Blanditiis alias tempora molestiae cumque labore excepturi repellat consequatur. Quia quo dolorem quis aut fugit enim ullam facere ducimus. Modi accusamus error. Consequatur nostrum nihil fugiat est deleniti.,https://source.unsplash.com/collection/1163637/100x100,511.934.779,true,Damon Intelligent Frozen Mouse,Hat
Mac Unbranded Cotton Gloves,Keyboard,3,1,false,1582.00,  Awesome Keyboard,Qui quas qui modi modi aut. Labore a libero temporibus voluptatem occaecati et reiciendis. Ab aperiam asperiores possimus nostrum. Quos vero quam quas. Occaecati inventore labore vel est placeat. Distinctio quis ut enim ut consequatur.,https://source.unsplash.com/collection/1163637/100x100,919.602.364,false,null,null
Summer Awesome Granite Cheese,Cheese,1,4,true,1383.00,  Gorgeous Cheese,Aliquid sed quod. Minus in similique molestiae accusamus exercitationem voluptatem quaerat iste quam. Nam ipsam magni saepe. Magni dolorem molestiae. Est aut vero suscipit illo sed.,https://source.unsplash.com/collection/1163637/100x100,187.728.7,true,Ron Fantastic Plastic Tuna,Shoes
Trey Incredible Wooden Shirt,Salad,2,4,true,1760.00,  Generic Salad,Nisi alias sed quo. Quo incidunt similique natus a. Natus eveniet iste sit doloribus perspiciatis nihil. Exercitationem numquam sed.,https://source.unsplash.com/collection/1163637/100x100,567.867.312,true,Lacy Unbranded Rubber Fish,Car
Jarod Unbranded Steel Table,Chips,4,1,true,1909.00,  Practical Chips,Est distinctio quas eius molestiae est nam excepturi. Voluptatibus asperiores eligendi. Placeat tempore exercitationem est harum dolor error expedita. Est aut velit qui et. Voluptatem quas minima non inventore.,https://source.unsplash.com/collection/1163637/100x100,646.167.322,false,null,null
Kirstin Gorgeous Frozen Bacon,Fish,4,3,true,1281.00,  Tasty Fish,Distinctio odit aliquid. Ea et autem culpa officiis beatae quis. Eligendi nemo sapiente vero voluptate et qui aliquam aliquam. Corrupti facilis quidem accusamus et fuga ut explicabo.,https://source.unsplash.com/collection/1163637/100x100,594.886.765,false,null,null
Mellie Small Cotton Shoes,Soap,3,1,false,1692.00,  Unbranded Soap,Nesciunt aut veniam voluptatem soluta voluptatem placeat voluptatem. Quis numquam veritatis aut provident eius. Ex ea omnis et illo. Facere et expedita accusantium accusantium aperiam. Veritatis id sed consequatur sit consequatur. Quod rerum eum.,https://source.unsplash.com/collection/1163637/100x100,172.787.591,false,null,null
Casandra Ergonomic Steel Pants,Pizza,4,3,true,1144.00,  Incredible Pizza,In quia voluptatem. Culpa quia placeat temporibus. Impedit architecto fuga eligendi voluptas sed eum molestiae et. Qui eligendi dicta quo sint sit consequatur tempore.,https://source.unsplash.com/collection/1163637/100x100,746.228.357,false,null,null
Montana Awesome Rubber Shoes,Car,1,3,true,1103.00,  Practical Car,Nesciunt sapiente voluptatem mollitia nobis placeat ex dolorum modi voluptatem. Modi sed autem nisi reiciendis ea. Eius quidem cumque tenetur. Assumenda et et molestiae deserunt adipisci quas doloremque in. Dolore expedita quo eum voluptatum facere repellendus eos.,https://source.unsplash.com/collection/1163637/100x100,50.75.739,false,null,null
Jody Gorgeous Wooden Chair,Table,2,5,true,1200.00,  Awesome Table,Ipsam quisquam officia ipsa cupiditate veritatis. Beatae ut quae expedita eaque labore sit ab quis. Placeat velit sit molestiae quis. Rerum assumenda repellat esse deserunt odio et minus. Occaecati dolor aperiam omnis aut ut assumenda aperiam ullam.,https://source.unsplash.com/collection/1163637/100x100,870.298.123,false,null,null
Sammie Ergonomic Soft Bike,Towels,2,3,true,1804.00,  Awesome Towels,Ut ut aperiam beatae sit quis. Corporis sapiente omnis. Quam eligendi optio ut. Qui cupiditate ea earum ea et. Delectus quos delectus beatae soluta tempore libero ipsam. Qui exercitationem aperiam.,https://source.unsplash.com/collection/1163637/100x100,373.780.12,true,Elissa Sleek Rubber Keyboard,Mouse
Kamren Handmade Wooden Hat,Pants,5,2,false,1838.00,  Tasty Pants,Modi repellat voluptas beatae. Nihil ad minus sequi eaque eveniet fugit ducimus. Nihil explicabo magni hic fugiat voluptatibus.,https://source.unsplash.com/collection/1163637/100x100,246.729.145,false,null,null
Reynold Rustic Wooden Chicken,Tuna,5,3,true,1198.00,  Fantastic Tuna,Omnis aperiam sed voluptate ipsa ratione sunt voluptatem doloremque. Ullam sed velit dolores velit suscipit rerum. Blanditiis exercitationem qui mollitia vero atque ad laboriosam hic sed. Esse quisquam doloremque. Magni iste in totam aut nostrum aut vel quia consequatur.,https://source.unsplash.com/collection/1163637/100x100,781.863.65,false,null,null
Marc Ergonomic Frozen Mouse,Cheese,1,3,false,1385.00,  Licensed Cheese,Est facilis est et ipsam illo occaecati odit. Occaecati quia est. Ab eos enim voluptas nulla commodi praesentium accusamus sit.,https://source.unsplash.com/collection/1163637/100x100,759.945.641,false,null,null
Angelina Practical Soft Pants,Mouse,5,4,false,1303.00,  Tasty Mouse,Exercitationem quibusdam earum ut tempore expedita. Omnis voluptas suscipit. Non repudiandae temporibus sed dolor et deleniti reiciendis. Nostrum ea nulla esse sed maxime. Optio molestiae illum adipisci modi officiis et et. Consequatur qui sapiente dolorem nostrum.,https://source.unsplash.com/collection/1163637/100x100,195.791.122,false,null,null
Emilio Rustic Concrete Bike,Chicken,1,5,false,1367.00,  Handmade Chicken,Repellendus sequi voluptatem non a est modi blanditiis. Corporis debitis dolor laborum omnis sint. Sit eaque illum modi est fuga cupiditate molestiae dolore dolorum. Deleniti voluptatem sunt aut quam. Molestias perferendis corporis velit doloribus. Et consequuntur molestiae consequatur ratione nisi cupiditate asperiores quia.,https://source.unsplash.com/collection/1163637/100x100,586.863.13,false,null,null
Gabriel Handcrafted Wooden Sausages,Shirt,1,4,true,1182.00,  Generic Shirt,Voluptate enim molestiae in. Et sint ipsum. Consectetur voluptatum et quia. Quia molestias velit voluptas.,https://source.unsplash.com/collection/1163637/100x100,699.285.38,true,Lizeth Gorgeous Fresh Bike,Cheese
Valentin Licensed Plastic Ball,Bacon,3,1,true,1786.00,  Tasty Bacon,Facilis non nulla saepe doloribus suscipit id est velit quia. Recusandae dolorem saepe. Voluptatem autem quo fugit sequi dolor possimus rerum consequatur. Repellat eum qui neque voluptatibus sed. Ut et tempore nobis vitae officia et neque.,https://source.unsplash.com/collection/1163637/100x100,922.671.422,false,null,null
Rosalind Licensed Metal Bike,Salad,5,3,false,1186.00,  Ergonomic Salad,Fugit nulla voluptas temporibus magni asperiores. Accusantium sequi id eveniet esse impedit quos. Sint exercitationem praesentium quis nemo mollitia cumque fuga.,https://source.unsplash.com/collection/1163637/100x100,830.502.561,false,null,null
Yvette Tasty Soft Towels,Chair,4,3,true,1109.00,  Sleek Chair,Ea sunt quisquam quidem nihil sequi. Deleniti voluptatem corporis et iste atque. Harum saepe pariatur impedit repudiandae qui error in. Aut consequuntur est.,https://source.unsplash.com/collection/1163637/100x100,368.778.949,false,null,null
Rebekah Gorgeous Metal Salad,Shirt,4,4,false,1007.00,  Handcrafted Shirt,Qui doloribus vitae eum sunt in recusandae consectetur in et. Harum enim sed ab alias dolorum. Labore nobis iure voluptatem tempore corrupti eligendi et. Quia facere ut et aut aut. Quas tenetur in unde aliquid optio explicabo sit doloremque. Accusantium exercitationem dolor fugiat.,https://source.unsplash.com/collection/1163637/100x100,622.667.586,true,Iva Handmade Rubber Shoes,Pizza
Amara Rustic Frozen Table,Chair,4,5,true,1304.00,  Refined Chair,Atque blanditiis ipsa voluptatibus sunt qui non voluptatum delectus quas. Hic ea deserunt vel qui est dolores ratione esse. Aut quia minus magni qui et eum. Quis laborum architecto voluptatem molestias consequuntur eos dolorem culpa consequatur. Maiores molestiae exercitationem quod amet sequi dolor eos.,https://source.unsplash.com/collection/1163637/100x100,853.462.54,false,null,null
Jazlyn Generic Fresh Fish,Fish,3,3,false,1915.00,  Fantastic Fish,Sit exercitationem placeat. Corporis et quidem adipisci rerum minus ea voluptate deleniti earum. Debitis dignissimos in vel voluptas tempore voluptate quo et. Quos perspiciatis quam adipisci non consequatur repellat voluptatibus. Quo quia sit voluptate assumenda est facere dignissimos. Id alias labore iusto.,https://source.unsplash.com/collection/1163637/100x100,898.450.492,true,Harrison Sleek Rubber Chair,Pants
Rylee Fantastic Cotton Sausages,Shoes,4,4,true,1786.00,  Unbranded Shoes,Ut accusantium ratione id. Aliquam quam praesentium et quo nisi dolore nesciunt non. Accusamus blanditiis consequatur ea. Rerum provident deleniti temporibus consectetur et dicta facilis. Numquam qui sed et harum vero. Consequatur a officia sunt expedita ut.,https://source.unsplash.com/collection/1163637/100x100,93.404.212,true,Jerrod Unbranded Plastic Soap,Shoes
Taryn Small Steel Soap,Chicken,2,3,true,1120.00,  Incredible Chicken,Cupiditate velit eum possimus voluptatibus eum placeat. Autem voluptatem ratione ducimus nihil repellat fuga. Illo perspiciatis dolorem harum enim unde.,https://source.unsplash.com/collection/1163637/100x100,837.174.336,true,Georgette Incredible Rubber Fish,Cheese
Carolyne Practical Cotton Hat,Gloves,5,5,false,1793.00,  Licensed Gloves,Ut odit ea qui quod et deleniti voluptatibus. Est ipsa magnam aut quas reprehenderit placeat. Vero nulla aut maxime incidunt iste.,https://source.unsplash.com/collection/1163637/100x100,987.316.383,false,null,null
Elliott Rustic Concrete Cheese,Sausages,5,3,true,1639.00,  Awesome Sausages,Quis earum quis distinctio sint quas eius consectetur rerum. Unde est velit voluptate impedit maiores. Minima voluptates hic nihil recusandae sint excepturi sed. Molestiae saepe unde enim consequatur vel dicta quo optio quis. Deleniti ut praesentium consectetur facere nostrum aut est. Esse nihil et.,https://source.unsplash.com/collection/1163637/100x100,38.482.535,true,Malachi Tasty Wooden Fish,Sausages
Ardith Unbranded Soft Salad,Cheese,2,5,false,1106.00,  Tasty Cheese,Cum libero architecto ea exercitationem quos fuga accusantium. Quaerat eaque suscipit eius quo accusamus ut. Voluptatibus consequuntur veritatis consequatur neque natus dolores enim maiores quo. Cum omnis error aspernatur est est fugiat sit ab inventore. Porro quo id sint repudiandae molestiae eos quis qui voluptas. Et ab quibusdam qui.,https://source.unsplash.com/collection/1163637/100x100,944.961.519,true,Orval Awesome Cotton Soap,Pizza
Ethel Incredible Granite Bacon,Chips,4,3,true,1846.00,  Sleek Chips,Laboriosam expedita pariatur architecto et quo in voluptate. Eligendi et et voluptatem libero iste. Maxime possimus maxime rerum tempora omnis aut ea ut possimus. Qui omnis qui.,https://source.unsplash.com/collection/1163637/100x100,85.134.354,true,Ken Incredible Rubber Ball,Computer
Maxime Generic Concrete Shoes,Shirt,2,3,true,1902.00,  Intelligent Shirt,Quis sunt autem. Iure dicta vel commodi totam culpa sapiente fuga nulla minus. Sed a explicabo reprehenderit.,https://source.unsplash.com/collection/1163637/100x100,191.567.158,true,Elvie Ergonomic Steel Fish,Bacon
Christina Handcrafted Wooden Computer,Ball,1,2,true,1138.00,  Gorgeous Ball,Autem est est architecto sit incidunt. Non sunt quis et architecto ea eos earum quia saepe. Quasi et quia quibusdam deserunt quae eum magni ut. Ducimus neque labore et eligendi ex. Quia non provident nisi pariatur.,https://source.unsplash.com/collection/1163637/100x100,254.746.841,true,Abby Incredible Steel Fish,Gloves
Diamond Generic Cotton Tuna,Car,3,3,true,1443.00,  Fantastic Car,Ipsum rerum eos molestias ut saepe nam praesentium ipsam qui. Molestias reprehenderit ullam corrupti quaerat omnis reiciendis numquam accusamus sequi. Quia quis rerum cum maxime. Quas molestias sit vel tempora eum. Qui et et enim atque.,https://source.unsplash.com/collection/1163637/100x100,759.147.355,true,Rosario Awesome Steel Pants,Tuna
Austyn Unbranded Plastic Mouse,Bike,1,5,false,1559.00,  Sleek Bike,Quibusdam rerum provident consequatur dolores facilis voluptas nulla voluptatem. Non illo non animi fugiat autem suscipit. Quisquam placeat omnis. Voluptatem cumque eligendi debitis voluptates similique commodi voluptas ab. Officiis ratione est et quam quibusdam porro laborum exercitationem. Expedita quae dolor ex non repellendus minima voluptas.,https://source.unsplash.com/collection/1163637/100x100,417.119.820,false,null,null
Alf Ergonomic Soft Hat,Ball,1,5,true,1994.00,  Awesome Ball,Et expedita vel nulla. Repellendus vel porro eligendi enim non dolor rerum omnis vitae. Blanditiis dolorum in rerum nisi soluta voluptatum.,https://source.unsplash.com/collection/1163637/100x100,849.659.15,true,Theodora Rustic Frozen Tuna,Shirt
Guy Handmade Wooden Pants,Pants,4,2,true,1775.00,  Small Pants,Omnis quam deleniti dicta commodi similique vel. Voluptate placeat qui aperiam consequuntur porro ab. Voluptas amet officiis quia optio sint eos.,https://source.unsplash.com/collection/1163637/100x100,328.470.234,true,Shakira Sleek Cotton Pizza,Chair
Cleveland Incredible Frozen Car,Chips,4,1,false,1058.00,  Gorgeous Chips,Numquam ex sunt hic molestiae aut. Soluta quia qui corporis consequuntur quo. Earum error inventore in vitae nam et eligendi velit ducimus. Eum magni repellendus.,https://source.unsplash.com/collection/1163637/100x100,814.945.997,false,null,null
Mable Incredible Wooden Tuna,Salad,2,4,true,1352.00,  Sleek Salad,Rerum consectetur minus enim quis distinctio nisi ipsa et cum. Aspernatur saepe ab doloremque. Facilis dolorem commodi dicta modi esse mollitia non.,https://source.unsplash.com/collection/1163637/100x100,208.817.813,true,Patrick Practical Steel Fish,Cheese
