Vance Ergonomic Concrete Keyboard,Pants,4,5,true,1016.00,  Practical Pants,Explicabo reprehenderit et dignissimos odio voluptatum. Excepturi libero repellendus delectus molestias quod dignissimos. Nihil quis architecto vitae aut velit aliquam alias. Quis et quia est neque quo voluptatibus distinctio.,https://source.unsplash.com/collection/1163637/100x100,872.999.290,false,null,null
Twila Tasty Steel Salad,Chicken,2,2,false,1913.00,  Incredible Chicken,Fuga cumque suscipit repellat. Libero voluptatum velit et sit alias. Quasi accusamus doloremque. Qui velit rerum qui alias.,https://source.unsplash.com/collection/1163637/100x100,65.802.982,false,null,null
Jason Small Rubber Gloves,Fish,2,4,false,1958.00,  Sleek Fish,Ullam quo ea. Voluptatem quam architecto. Nulla inventore nisi qui et fugit saepe architecto ut. Sit laudantium ea et fuga perspiciatis quos. Animi cumque quo repellendus quas quia nemo magni deleniti delectus. Veritatis dolor est et dicta est cumque.,https://source.unsplash.com/collection/1163637/100x100,63.352.425,false,null,null
Antonio Small Fresh Ball,Table,1,2,false,1503.00,  Licensed Table,Et amet dicta porro corrupti unde facere. Voluptate qui architecto pariatur. Reiciendis velit in.,https://source.unsplash.com/collection/1163637/100x100,344.349.735,false,null,null
Johathan Incredible Cotton Shirt,Shirt,3,1,false,1157.00,  Gorgeous Shirt,Voluptas hic accusamus pariatur ut illum aliquid aut quas corrupti. Cupiditate explicabo aspernatur quaerat sed quod. Dolore vitae magnam numquam.,https://source.unsplash.com/collection/1163637/100x100,529.131.359,true,Camille Unbranded Fresh Ball,Computer
Genoveva Ergonomic Rubber Chair,Pizza,2,5,false,1027.00,  Handcrafted Pizza,Qui saepe aut et quia voluptas. Nihil et asperiores. Voluptas necessitatibus aliquam sed quo maxime accusantium cumque inventore ullam. Accusamus eius fuga incidunt id esse consequatur voluptate. Ipsa quos odit. Nobis est nulla voluptate veniam quibusdam officia ab animi.,https://source.unsplash.com/collection/1163637/100x100,650.622.103,false,null,null
Janiya Incredible Cotton Keyboard,Chair,3,2,false,1885.00,  Small Chair,Veritatis placeat eveniet ut beatae. Blanditiis pariatur dolor voluptatum et vel voluptates officia ipsam. Eveniet fugit qui soluta et. Atque dolor quo quod rem vitae eligendi est error. Qui sed ullam at error.,https://source.unsplash.com/collection/1163637/100x100,550.504.965,false,null,null
Euna Small Cotton Pants,Car,3,1,true,1779.00,  Rustic Car,Et et aut non sit reiciendis. Pariatur aperiam et reprehenderit qui molestias. Laboriosam quis aut odit et consectetur ex. Accusantium voluptatem deleniti est doloremque. Occaecati magni suscipit sit corrupti.,https://source.unsplash.com/collection/1163637/100x100,483.379.169,true,Cale Gorgeous Soft Chips,Mouse
Trinity Sleek Steel Bike,Bacon,2,3,true,1768.00,  Licensed Bacon,Illo et provident enim omnis aut. Id quisquam iste. Laboriosam eos vel repellat qui. Qui voluptatem consequuntur aperiam ut sunt.,https://source.unsplash.com/collection/1163637/100x100,651.841.838,true,Kaya Practical Steel Car,Bike
Lewis Handcrafted Steel Ball,Salad,4,2,false,1219.00,  Gorgeous Salad,Est magnam provident explicabo repudiandae dignissimos excepturi. Est odit animi eaque laboriosam vero ut qui ab. Molestiae quaerat eos voluptas neque maxime et ipsam. Voluptatibus commodi nam labore illum asperiores omnis in ea aut. Error placeat soluta.,https://source.unsplash.com/collection/1163637/100x100,533.565.627,true,Oleta Awesome Granite Computer,Shirt
Pasquale Awesome Frozen Salad,Shoes,5,1,false,1408.00,  Rustic Shoes,Modi aut delectus quaerat praesentium et placeat et a. Asperiores earum quidem nulla quam et vel aliquid. Est quisquam ipsa voluptates ut sint. Voluptatem qui aut tempora excepturi. Neque nobis beatae eveniet. Quis aut id magnam quam adipisci accusamus corporis.,https://source.unsplash.com/collection/1163637/100x100,637.424.0,true,Beaulah Handcrafted Frozen Soap,Mouse
Quentin Small Fresh Chicken,Fish,4,5,false,1735.00,  Intelligent Fish,Qui adipisci labore rem neque modi eaque reiciendis. Sapiente aliquid ex provident accusantium molestiae ut similique. Magni rerum enim enim ex necessitatibus molestiae. Perspiciatis est maiores tenetur qui. Ex quia nihil sed.,https://source.unsplash.com/collection/1163637/100x100,145.232.771,true,Isobel Gorgeous Wooden Computer,Chair
Audreanne Unbranded Fresh Bacon,Table,1,1,false,1297.00,  Small Table,Quis corrupti rem itaque. Reiciendis sed sed ut distinctio adipisci ut necessitatibus. Accusamus et magnam harum. Totam corrupti dolorem ipsam. Distinctio quia dolorem delectus. Minus atque quia maiores enim totam culpa accusantium eos.,https://source.unsplash.com/collection/1163637/100x100,613.934.419,true,Laron Sleek Plastic Soap,Chips
Darren Fantastic Steel Tuna,Bike,3,3,true,1494.00,  Practical Bike,Molestias nam omnis quis dolores velit. Delectus soluta reprehenderit ea quaerat in officiis quos possimus dolorem. Reprehenderit fugit voluptatem. Excepturi nesciunt voluptas labore doloremque amet. Alias temporibus voluptatem hic. Ut quo ad optio itaque ullam.,https://source.unsplash.com/collection/1163637/100x100,327.870.869,true,Brooklyn Unbranded Granite Pants,Gloves
Amelia Small Soft Bike,Fish,4,3,false,1965.00,  Fantastic Fish,Omnis laudantium quidem magnam fugit architecto. Ratione soluta et sed fuga voluptas quia. Aliquam ut expedita dolore cum. Dolor ipsa ut unde similique odit dignissimos temporibus reprehenderit. Corrupti ea quas eum omnis omnis nesciunt.,https://source.unsplash.com/collection/1163637/100x100,634.77.643,true,Norma Unbranded Metal Soap,Table
Marilou Awesome Metal Chair,Cheese,1,4,true,1686.00,  Refined Cheese,Aut illo excepturi quam nulla. Optio qui fugit voluptate similique omnis delectus modi numquam. Rerum suscipit enim ratione. Impedit consequatur minima et commodi vel et. Aliquam nesciunt ducimus qui laudantium aperiam harum. Voluptas et voluptatem ut quo.,https://source.unsplash.com/collection/1163637/100x100,489.351.298,true,Brigitte Refined Wooden Pants,Ball
Blaze Incredible Rubber Keyboard,Mouse,3,1,false,1663.00,  Gorgeous Mouse,Quasi quibusdam officia ratione iusto et debitis et. Ipsam quas nobis voluptas tenetur recusandae. In non harum dicta possimus voluptas pariatur eum accusantium excepturi. Reprehenderit enim aspernatur et et aut accusamus. Commodi quia voluptas. Saepe odio et hic fugit sunt voluptatum sit.,https://source.unsplash.com/collection/1163637/100x100,135.197.381,true,Harold Licensed Metal Fish,Towels
Eva Ergonomic Soft Sausages,Bike,2,1,true,1365.00,  Handcrafted Bike,Sed maiores architecto voluptatem eligendi ex omnis voluptatum odit dolore. Voluptas voluptatem asperiores exercitationem. Minima voluptas amet. Commodi cumque sint aperiam.,https://source.unsplash.com/collection/1163637/100x100,462.435.304,false,null,null
Jerrod Generic Metal Chips,Sausages,3,1,false,1383.00,  Refined Sausages,Ea dicta possimus tenetur nisi voluptas qui excepturi. Et in odit non. Quo et aut voluptas dolor et non maxime accusantium at.,https://source.unsplash.com/collection/1163637/100x100,339.216.794,false,null,null
Tamia Small Granite Salad,Bacon,1,4,false,1559.00,  Ergonomic Bacon,Pariatur quo deleniti nihil soluta. Modi non est voluptatem perspiciatis. Dolor est suscipit non.,https://source.unsplash.com/collection/1163637/100x100,441.231.685,false,null,null
Reece Ergonomic Soft Cheese,Keyboard,2,3,false,1733.00,  Awesome Keyboard,Fuga sit est ea reiciendis expedita aspernatur quia et. Voluptas et optio sed est ab laborum sint. Cupiditate quia ex et pariatur sunt aut enim.,https://source.unsplash.com/collection/1163637/100x100,777.317.455,true,Eulalia Small Rubber Bike,Shirt
Lucio Sleek Rubber Towels,Keyboard,4,4,true,1967.00,  Licensed Keyboard,Et sit nobis eligendi sapiente officiis. Aut rerum sequi eligendi. Suscipit minus blanditiis qui odit voluptas qui.,https://source.unsplash.com/collection/1163637/100x100,793.341.786,true,Angelo Generic Fresh Bike,Towels
Brooks Licensed Steel Ball,Table,2,4,false,1213.00,  Generic Table,Qui labore ipsam odio quia sapiente minus voluptas. Dignissimos sit voluptatem veniam facilis ut. Debitis et error debitis aut sunt veritatis delectus ipsam. Expedita quis sit sint tempora ratione et iusto. Accusantium nobis similique quae deleniti quasi.,https://source.unsplash.com/collection/1163637/100x100,131.658.143,false,null,null
Ashlee Gorgeous Concrete Towels,Bike,1,5,false,1263.00,  Intelligent Bike,Sit ducimus eum facilis facere voluptatem maiores. Aut dolor suscipit ipsa quam ipsam amet. Veritatis rerum ea et tenetur quis. Aut veritatis libero molestiae id hic eos. Culpa iste ipsa. Autem quia dolores ut fugit incidunt officia reprehenderit reprehenderit illo.,https://source.unsplash.com/collection/1163637/100x100,741.520.862,false,null,null
Marlee Intelligent Rubber Tuna,Chicken,4,1,true,1852.00,  Generic Chicken,Sed ipsum vitae error optio laborum. Est saepe et ut cumque assumenda architecto perspiciatis magnam. Dolor libero minus aut distinctio dolores molestiae tempore occaecati. Omnis voluptatum nesciunt quia ad dignissimos ipsam vitae nulla.,https://source.unsplash.com/collection/1163637/100x100,243.182.988,true,Merle Incredible Frozen Shoes,Soap
Joanny Unbranded Soft Pants,Chicken,4,3,true,1787.00,  Intelligent Chicken,Ad reiciendis aperiam molestias reiciendis et porro eveniet dolor. Culpa et nobis ut consequatur molestiae aut iusto. Quidem quasi assumenda fugit ullam voluptatem quis quis.,https://source.unsplash.com/collection/1163637/100x100,790.148.348,true,Amber Awesome Steel Cheese,Bike
Samir Awesome Soft Mouse,Ball,1,1,false,1676.00,  Sleek Ball,Dignissimos at eligendi corporis magni. Explicabo architecto et illum. Modi dolor nesciunt qui tenetur maxime modi et. Nam nobis vitae est ad. Hic ab numquam dolorum repellat et ipsum est eos.,https://source.unsplash.com/collection/1163637/100x100,592.42.696,true,Roberto Gorgeous Soft Chips,Table
Jillian Unbranded Concrete Car,Ball,4,4,true,1437.00,  Intelligent Ball,Voluptatem totam veniam aut corrupti qui quis aut eligendi minus. Quis aut earum eveniet quod dignissimos impedit. Id consectetur ut. Tempore eum cum. Et sunt doloremque. Est sit tempore qui et ut atque rerum est aliquam.,https://source.unsplash.com/collection/1163637/100x100,378.235.568,true,Lura Licensed Rubber Shoes,Towels
Kale Handmade Soft Soap,Chair,1,2,false,1095.00,  Rustic Chair,Ut atque eos dignissimos magni illum repellendus eaque est earum. Autem modi aliquid non doloremque provident nihil dolor est voluptas. Autem quasi autem. Et commodi voluptatem dolores autem tenetur.,https://source.unsplash.com/collection/1163637/100x100,8.631.822,false,null,null
Trey Incredible Wooden Computer,Chair,1,4,true,1761.00,  Generic Chair,Est quae magni aut voluptatem. Nemo consequuntur temporibus nihil ea ut. Illo amet totam eum.,https://source.unsplash.com/collection/1163637/100x100,122.730.916,true,Aiyana Sleek Wooden Bike,Shirt
Imani Gorgeous Wooden Sausages,Towels,3,4,false,1075.00,  Ergonomic Towels,Minus ducimus doloremque ullam non. Recusandae id consequatur minus modi voluptatibus molestiae distinctio est voluptas. Dolor quisquam est laborum deserunt. Autem odit aperiam rem neque provident cupiditate. Voluptatem nisi iste qui magnam qui molestiae.,https://source.unsplash.com/collection/1163637/100x100,225.346.568,true,Korbin Fantastic Metal Chicken,Sausages
Era Practical Steel Sausages,Mouse,5,2,true,1714.00,  Generic Mouse,Molestiae ipsum ipsum quia assumenda voluptas nobis non. Dolor sed et consectetur provident accusantium ea nisi. Quis molestias cumque quam est fugit.,https://source.unsplash.com/collection/1163637/100x100,29.249.262,true,Beverly Refined Wooden Mouse,Bacon
Nicolette Unbranded Granite Cheese,Tuna,2,5,true,1573.00,  Incredible Tuna,Omnis aut minus nisi accusamus amet. Velit mollitia omnis nulla eos. Officia id enim et consectetur et consectetur est consequatur voluptatum. Beatae vel ducimus in facilis quae quia velit aut excepturi. Qui unde exercitationem ea. Est delectus sint qui corporis velit ea tempore error.,https://source.unsplash.com/collection/1163637/100x100,103.312.492,true,Emmett Intelligent Soft Bike,Chair
Joseph Tasty Plastic Chicken,Chair,1,3,false,1377.00,  Gorgeous Chair,Quibusdam dolores alias voluptatem. Eos accusamus voluptas ipsa quaerat iure ullam nam. Numquam commodi ratione fugit ducimus.,https://source.unsplash.com/collection/1163637/100x100,409.994.158,false,null,null
Janae Ergonomic Wooden Chips,Chair,3,4,true,1982.00,  Small Chair,Ut fuga distinctio qui dolorem. Aperiam omnis autem vel non. Voluptates temporibus suscipit.,https://source.unsplash.com/collection/1163637/100x100,733.587.506,true,Tess Ergonomic Frozen Soap,Sausages
Abdiel Refined Cotton Bike,Bacon,1,1,false,1298.00,  Incredible Bacon,Ipsa aut dolorem vitae atque. Distinctio quas dolor quae consequatur blanditiis quasi. Architecto qui voluptatum facilis at debitis et et quidem libero. Dolores sint voluptatem corrupti ut consectetur.,https://source.unsplash.com/collection/1163637/100x100,100.23.449,false,null,null
Wellington Tasty Soft Computer,Tuna,5,3,true,1350.00,  Handmade Tuna,Voluptas necessitatibus voluptas maiores aut sed quaerat ducimus nemo harum. Et totam quia. Veniam cumque incidunt laborum culpa omnis hic vel. Sed molestiae temporibus asperiores voluptatibus expedita ut voluptatem.,https://source.unsplash.com/collection/1163637/100x100,547.704.886,true,Marilyne Fantastic Soft Car,Table
Rogelio Rustic Granite Shoes,Fish,1,3,true,1592.00,  Licensed Fish,Deserunt officia doloribus laboriosam nam vitae quo nemo id mollitia. Sit ipsum quo autem quod nisi quidem maiores nostrum ut. Accusantium voluptatem a eligendi eveniet. Quia inventore voluptatem sapiente odio id ratione.,https://source.unsplash.com/collection/1163637/100x100,184.433.350,false,null,null
Jacinthe Sleek Steel Chips,Hat,2,3,false,1977.00,  Refined Hat,Quam aut odio et cupiditate. Pariatur voluptas quia illum rem. Expedita molestias facere perspiciatis.,https://source.unsplash.com/collection/1163637/100x100,939.817.125,false,null,null
Bianka Refined Metal Cheese,Ball,2,4,true,1086.00,  Unbranded Ball,Et et earum ut corporis voluptatum modi impedit. Est quia enim et autem quo eius sequi. Molestiae repellat dolorem ut. Consectetur eos est. Laudantium dolorem laborum perferendis debitis ducimus tenetur quisquam et est.,https://source.unsplash.com/collection/1163637/100x100,791.849.492,false,null,null
Kennedi Licensed Frozen Bacon,Bacon,5,4,true,1129.00,  Small Bacon,Ipsam itaque facere dolor. Minima rerum sit adipisci ut. Dignissimos veritatis quibusdam maxime a molestiae.,https://source.unsplash.com/collection/1163637/100x100,349.596.664,false,null,null
Bernard Small Frozen Mouse,Sausages,5,4,true,1810.00,  Unbranded Sausages,Sit quisquam ut esse. Et placeat incidunt unde veritatis quo sed. Impedit aliquam iusto. Aut unde qui perspiciatis rerum esse enim quibusdam.,https://source.unsplash.com/collection/1163637/100x100,894.615.506,true,Emely Generic Fresh Ball,Table
Aric Rustic Metal Table,Salad,2,5,false,1988.00,  Refined Salad,Illo beatae laborum dicta. Quidem doloremque consequuntur beatae. Possimus nostrum optio numquam accusamus doloremque. Impedit quas qui officia accusamus enim fugit ea voluptas.,https://source.unsplash.com/collection/1163637/100x100,799.915.369,true,Madisyn Ergonomic Wooden Gloves,Bacon
Santiago Unbranded Cotton Shirt,Shoes,2,1,true,1269.00,  Tasty Shoes,Quo ut cupiditate nulla doloribus natus nemo perspiciatis. Aspernatur voluptatem mollitia cum. Repudiandae ipsum qui quas. Ut ullam praesentium.,https://source.unsplash.com/collection/1163637/100x100,816.420.920,true,Kristofer Sleek Concrete Pizza,Table
Damaris Awesome Steel Table,Pizza,2,3,false,1317.00,  Incredible Pizza,Velit corporis corporis eaque iure ad itaque sequi. Necessitatibus in id eos ullam soluta. Vel in consectetur recusandae voluptatum ratione qui temporibus harum. Qui reprehenderit velit quo veritatis similique nemo totam eum et. Ipsam deserunt fugit ex odit nisi. Consequatur et voluptates atque reiciendis et ducimus velit amet laudantium.,https://source.unsplash.com/collection/1163637/100x100,834.506.781,true,Maia Incredible Rubber Car,Soap
Keshawn Handcrafted Cotton Sausages,Ball,1,3,true,1345.00,  Incredible Ball,A id temporibus. Aut aperiam eius soluta officia itaque quos iste quia dicta. Expedita voluptate qui et quidem ex rerum nam est vero. Fuga repudiandae voluptate aut nostrum veniam doloremque minima explicabo.,https://source.unsplash.com/collection/1163637/100x100,344.905.437,true,Adrian Gorgeous Cotton Pizza,Tuna
Neva Licensed Granite Ball,Bike,5,4,false,1482.00,  Ergonomic Bike,Porro qui dolorem. Sint perspiciatis laudantium temporibus sit quia accusantium tempore. Nostrum optio corporis eius inventore ipsum. Occaecati molestiae esse unde corporis. Veritatis repellendus nihil sequi fuga est.,https://source.unsplash.com/collection/1163637/100x100,999.223.823,true,Jayda Incredible Rubber Chicken,Chips
Keaton Licensed Rubber Gloves,Sausages,5,2,true,1432.00,  Intelligent Sausages,Possimus qui asperiores ad sed. Corporis adipisci officia rem qui minus ex. Aliquam ratione necessitatibus nihil tempore. Ut facere reiciendis omnis officiis. Ipsam tenetur itaque fugiat.,https://source.unsplash.com/collection/1163637/100x100,603.721.51,true,Devyn Generic Steel Salad,Towels
Willa Licensed Rubber Hat,Shoes,1,3,true,1043.00,  Unbranded Shoes,Sed nesciunt voluptatum cum dolor officia. Nisi odio ea sint deserunt consectetur enim. Velit quasi quis possimus eveniet velit aperiam labore voluptatibus. Iste blanditiis id beatae necessitatibus repellat aut voluptas ullam aut. Rerum vel quo libero facilis rerum. Quibusdam voluptas quos.,https://source.unsplash.com/collection/1163637/100x100,904.732.541,true,Leif Incredible Metal Pizza,Tuna
Tyler Sleek Concrete Mouse,Pizza,1,1,false,1658.00,  Ergonomic Pizza,Rerum ea qui minima. Eaque delectus magnam eos. Rerum et sunt.,https://source.unsplash.com/collection/1163637/100x100,824.518.414,false,null,null
Preston Licensed Concrete Soap,Bike,5,2,true,1145.00,  Gorgeous Bike,Excepturi doloremque quasi. Debitis dolorum enim eligendi. Officiis error voluptatem aperiam. Id incidunt molestias officia. Ut odio adipisci dolorem fugit non nostrum ut.,https://source.unsplash.com/collection/1163637/100x100,718.410.170,false,null,null
Torrey Unbranded Metal Pizza,Cheese,5,3,true,1651.00,  Awesome Cheese,Dolor eos blanditiis vitae doloremque adipisci eligendi nemo. Rerum atque voluptatem iusto id amet aliquam ut et. Dolorem minima et eos voluptatem ab occaecati ad cumque. Est animi quod harum sit quisquam enim minima est et.,https://source.unsplash.com/collection/1163637/100x100,238.125.656,true,Garry Practical Fresh Sausages,Chips
Rocky Practical Soft Chair,Pizza,1,2,true,1661.00,  Fantastic Pizza,Sed officia quos ut excepturi odit nam libero expedita dolorem. Sit impedit aliquam aliquam rem. Quia qui nam corrupti quas. Ut cum rerum eos sed unde perspiciatis modi. Nemo in nam.,https://source.unsplash.com/collection/1163637/100x100,322.786.843,true,Reese Awesome Cotton Shoes,Table
Nels Gorgeous Plastic Gloves,Chips,5,5,true,1470.00,  Fantastic Chips,Vel commodi nihil eum facilis molestias rem quidem provident. Quod porro aut ipsam qui. Eos blanditiis at maxime quis. Corporis ipsa expedita atque dolorum alias voluptatem earum magni. Autem culpa libero sed. Omnis voluptatem aperiam temporibus quo pariatur qui sit aperiam.,https://source.unsplash.com/collection/1163637/100x100,976.661.920,false,null,null
Skylar Handcrafted Fresh Computer,Mouse,5,1,false,1072.00,  Small Mouse,Nulla nihil beatae. Accusamus cumque voluptas quod vel accusantium. Quia blanditiis sunt est sunt et nisi odit. Accusamus pariatur laborum debitis. Omnis non minima animi sit maiores quae voluptas.,https://source.unsplash.com/collection/1163637/100x100,441.361.899,true,Claudie Generic Soft Chicken,Car
Carmel Fantastic Plastic Salad,Fish,4,2,true,1456.00,  Fantastic Fish,Voluptatem iste unde atque nulla qui aperiam veniam dignissimos et. Doloremque officiis at mollitia voluptatem. Sint quasi minima. Illo quibusdam ipsum et.,https://source.unsplash.com/collection/1163637/100x100,824.550.248,true,Ryleigh Refined Soft Bike,Computer
Hettie Rustic Metal Ball,Shirt,2,3,false,1350.00,  Licensed Shirt,Quia consequatur maxime voluptas cum rem voluptatum neque. Praesentium iure libero possimus esse dolores ea voluptas. Et non voluptas quisquam et ut repellendus. Nihil velit distinctio.,https://source.unsplash.com/collection/1163637/100x100,597.233.379,true,Ally Intelligent Rubber Cheese,Shoes
Lura Handcrafted Concrete Bike,Bacon,5,5,false,1881.00,  Ergonomic Bacon,Atque cum aut culpa natus facilis et. Atque occaecati tempora exercitationem et qui excepturi autem. Deleniti et autem iste facere quia enim tempora.,https://source.unsplash.com/collection/1163637/100x100,309.975.848,false,null,null
Naomi Ergonomic Granite Pizza,Bacon,3,2,false,1966.00,  Small Bacon,Atque cumque sint omnis vel quos tenetur. Praesentium odio dolorum asperiores omnis accusamus et ut eum. Nam quam quia. Necessitatibus expedita enim.,https://source.unsplash.com/collection/1163637/100x100,611.783.111,false,null,null
Anais Licensed Granite Bike,Table,2,3,false,1427.00,  Intelligent Table,Eos molestiae et modi. Atque sed aliquam esse quia et possimus expedita nihil ratione. Animi similique laborum. Ut ea deleniti enim ullam recusandae blanditiis. Aut dolor porro nemo quia ut quis fugiat est ullam. Qui neque velit consequuntur itaque molestiae ullam.,https://source.unsplash.com/collection/1163637/100x100,943.604.66,false,null,null
Ashly Intelligent Frozen Bike,Hat,2,1,true,1240.00,  Incredible Hat,Dicta consequatur veritatis ex. Modi consequatur et ad cupiditate impedit vel commodi magnam. Molestias qui consectetur culpa. Et explicabo voluptatibus odio accusantium explicabo. Sit harum dicta sint. Nam error quos facilis unde a placeat ipsum sed.,https://source.unsplash.com/collection/1163637/100x100,841.503.338,true,Maryse Incredible Fresh Gloves,Car
Theodore Unbranded Metal Pizza,Car,2,4,false,1226.00,  Handcrafted Car,Adipisci amet unde sit vel qui neque distinctio ut. Voluptatem sit sint velit ratione qui. Facilis veritatis iure magnam. Qui sunt rerum aut ex odit ipsa. Aut numquam dolorem harum dolore quos repellat illum et in. Non quia repudiandae ut hic placeat dolor excepturi eum.,https://source.unsplash.com/collection/1163637/100x100,173.870.630,true,Glenna Tasty Steel Shirt,Table
Sylvester Small Metal Soap,Tuna,1,1,true,1426.00,  Practical Tuna,Error saepe vel sit. Hic in perferendis dolorem consectetur. Voluptas aut aspernatur vel repellat voluptatem nobis. Et voluptatibus provident aut aut odio cupiditate perspiciatis sit. Ut aliquam aut sunt sapiente. Pariatur voluptate architecto sit voluptatum quos sit maxime corrupti aspernatur.,https://source.unsplash.com/collection/1163637/100x100,310.248.119,true,Garry Intelligent Wooden Bike,Shirt
Abagail Gorgeous Metal Towels,Cheese,3,1,true,1083.00,  Practical Cheese,Ea voluptate ut ut debitis tempore beatae corrupti ratione atque. Facere eos velit ea. Ut eligendi et ullam possimus.,https://source.unsplash.com/collection/1163637/100x100,113.538.35,true,Tom Tasty Granite Bike,Cheese
Arnulfo Licensed Cotton Shoes,Shoes,4,4,true,1255.00,  Small Shoes,Illo quas debitis dolorem quis dolorum est reprehenderit repellat occaecati. Quae dolor perspiciatis similique sed numquam enim sit. Harum quasi animi omnis in id est id. Et quaerat qui molestiae illum dolores impedit nam. Dolor maiores corrupti.,https://source.unsplash.com/collection/1163637/100x100,198.795.664,false,null,null
Melyna Refined Concrete Car,Ball,4,1,true,1417.00,  Ergonomic Ball,Consequatur aspernatur asperiores magnam magni qui voluptate sunt. Labore consequatur eum qui voluptas temporibus veritatis. Autem aut recusandae molestias non illo quia repellat. Voluptatem repellat error totam in officiis nulla quia eaque delectus.,https://source.unsplash.com/collection/1163637/100x100,584.837.867,true,Felipe Awesome Fresh Mouse,Salad
Florencio Ergonomic Cotton Chair,Cheese,1,1,false,1853.00,  Sleek Cheese,Consequatur error est dignissimos et saepe. Dolores beatae in quibusdam sapiente voluptatibus dignissimos. Est natus doloremque quas debitis aliquam sed voluptatem libero sit. Molestias sapiente libero necessitatibus minus commodi libero consequatur. Ipsa minus eum.,https://source.unsplash.com/collection/1163637/100x100,317.137.319,true,Sam Practical Wooden Pants,Bacon
Britney Unbranded Wooden Tuna,Bacon,1,2,false,1702.00,  Incredible Bacon,Dolores perspiciatis debitis. Est eveniet vel suscipit id voluptates. Odio voluptatem magni eaque.,https://source.unsplash.com/collection/1163637/100x100,15.564.368,true,Jeromy Gorgeous Rubber Ball,Gloves
Alexandra Awesome Rubber Bacon,Fish,4,3,true,1590.00,  Sleek Fish,Et suscipit quo molestiae. Beatae eaque est ea debitis. Et consectetur reiciendis mollitia in voluptas magnam. Ullam sint dignissimos eius quia. In consequatur libero asperiores quis ullam quos hic.,https://source.unsplash.com/collection/1163637/100x100,552.702.732,true,Lydia Licensed Soft Bike,Table
Gillian Incredible Granite Keyboard,Gloves,1,2,false,1634.00,  Gorgeous Gloves,Laborum quos aliquam optio qui recusandae. Sunt tempora eos est nesciunt. Aut dolorem explicabo mollitia et nesciunt qui cumque voluptatem. Omnis quia nemo molestiae. Animi et voluptatem nam.,https://source.unsplash.com/collection/1163637/100x100,899.825.68,false,null,null
